Title,Corp,Condition,Location,Tag,Link
Automotive 반도체 ISP SW / Embedded SW FAE / ISP 튜닝 및 HW,(주)넥스트칩,경력무관대졸↑정규직·전문연구요원,경기성남시 분당구,"PCB, S/W, 반도체, FPGA, 회로설계 외 등록일 22/09/21",https://www.saramin.co.kr/zf_user/jobs/relay/view?isMypage=no&rec_idx=44034355
"디스플레이장비 제어 소프트웨어개발 신입,경력 채용",(주)비아트론,신입·경력초대졸↑정규직,경기수원시 권선구,"C언어, VisualC·C++, PLC, C#, C++ 외 수정일 22/11/17",https://www.saramin.co.kr/zf_user/jobs/relay/view?isMypage=no&rec_idx=44390179
[화성]매장 관리자(매니저/부점장) 모집/이마트 트레이더스,(주)플레이타임그룹,"경력무관초대졸↑정규직2,600 이상 (면접 후 협의)",경기화성시,"유튜브, 고객응대, 매장관리, 매출관리, 매장관리 외 등록일 22/11/17",https://www.saramin.co.kr/zf_user/jobs/relay/view?isMypage=no&rec_idx=44455642
2022년 하반기 부문별 인재영입(경력),(주)핏펫,신입·경력학력무관정규직·계약직,서울강남구,"CEO, PM(프로젝트매니저), PowerPoint, Excel, CRM마케팅 외 수정일 22/11/18",https://www.saramin.co.kr/zf_user/jobs/relay/view?isMypage=no&rec_idx=44039792
[EY한영] 마켓본부 사업지원 (Business Development)팀 인턴,한영회계법인,신입대졸↑인턴직,서울영등포구,"리서치, 경영분석, 데이터분석, 회계법인 등록일 22/11/12",https://www.saramin.co.kr/zf_user/jobs/relay/view?isMypage=no&rec_idx=44418033
기구필라테스 전문강사 신입(자격증 교육과정 포함) / 경력 채용,(주)피티박스,경력무관고졸↑정규직,경기부천시,"트레이너, 필라테스, 스포츠강사, 스포츠센터, 휘트니스센터 등록일 22/11/09",https://www.saramin.co.kr/zf_user/jobs/relay/view?isMypage=no&rec_idx=44399852
[성수역] 인트로맨(주) 본사 잡매니저 정규직 채용,인트로맨(주),경력무관초대졸↑정규직,서울성동구,"HRM, 문서작성, 사무직, 사무행정, 서무 외 등록일 22/10/24",https://www.saramin.co.kr/zf_user/jobs/relay/view?isMypage=no&rec_idx=44267457
[위례]스타필드 어린이 실내 놀이시설 매장 관리자 모집,(주)플레이타임그룹,"경력무관초대졸↑정규직2,600 이상 (면접 후 협의)",경기하남시,"유튜브, 고객응대, 매장관리, 매출관리, 매장관리 외 수정일 22/11/17",https://www.saramin.co.kr/zf_user/jobs/relay/view?isMypage=no&rec_idx=44455763
[서울대 캠퍼스타운 x Mapsea] 해양데이터 서비스기획/PM 모집,(주)맵시,경력3년↑대졸↑정규직,서울관악구,"PM(프로젝트매니저), PL(프로젝트리더), 리서치, QA/테스터, UI/UX 외 수정일 22/11/18",https://www.saramin.co.kr/zf_user/jobs/relay/view?isMypage=no&rec_idx=44448528
"[쿠팡]안성5센터 진열/포장/집품 사원채용(쉬운업무,동반환영)",쿠팡풀필먼트서비스(유),경력무관학력무관계약직,경기안성시,"패킹(포장), 재고관리, 출고/출하, 입고/입하, 교환/반품 외 수정일 22/11/18",https://www.saramin.co.kr/zf_user/jobs/relay/view?isMypage=no&rec_idx=44377438
"2022 실티 스마트 농축산기계 2공장(유공압,계장)",(주)실티,"경력무관학력무관정규직3,000 (면접 후 협의)",경기고양시 일산동구,"PLC, 조립, 제조, 생산, 단순생산직 외 수정일 22/11/03",https://www.saramin.co.kr/zf_user/jobs/relay/view?isMypage=no&rec_idx=44195095
[테크섹션] 환경솔루션 기술영업 경력자 채용,(주)센티넬이노베이션,경력5년↑대졸↑정규직,경기의왕시,"영업, 기술영업, 영업관리, B2B, 환경기술영업 외 수정일 22/11/09",https://www.saramin.co.kr/zf_user/jobs/relay/view?isMypage=no&rec_idx=44389406
"생체인식 및 영상처리 석,박사 연구원(신입, 경력)",이후시스(주),신입·경력석사↑정규직,경기군포시,"C언어, 머신러닝, C#, OpenCV, C++ 외 수정일 22/11/11",https://www.saramin.co.kr/zf_user/jobs/relay/view?isMypage=no&rec_idx=44360016
모바일 솔루션 개발자,이지케어텍(주),경력 3~10년고졸↑정규직,서울전체,"Objective-C, 유지보수, C++, iOS, Swift 외 수정일 22/08/29",https://www.saramin.co.kr/zf_user/jobs/relay/view?isMypage=no&rec_idx=43861604
응용 소프트웨어 개발자 정규직 모집 (신입/경력),팔마텍,"신입·경력학력무관정규직4,000 만원",경북포항시 남구,"C언어, VisualC·C++, VisualBasic, MFC, C++ 외 등록일 22/10/12",https://www.saramin.co.kr/zf_user/jobs/relay/view?isMypage=no&rec_idx=44189127
홈쇼핑 및 온라인몰 CS 담당자 신규채용,(주)한국금거래소쓰리엠,경력2년↑초대졸↑정규직,서울종로구,"CS, 고객관리, 전화상담, 콜센터/고객센터, 단순안내 외 수정일 22/11/07",https://www.saramin.co.kr/zf_user/jobs/relay/view?isMypage=no&rec_idx=44280506
(주)머거본 유통영업(할인점/편의점 외) 모집,세계식품(주),경력3년↑학력무관정규직,경기용인시 기흥구,"영업관리, 매출관리, 거래처관리, 거래처영업, 유통영업 외 등록일 22/10/14",https://www.saramin.co.kr/zf_user/jobs/relay/view?isMypage=no&rec_idx=44201948
(주)미래컴퍼니 3D 카메라 구동용 S/W 개발자,(주)미래컴퍼니,경력 2~10년대졸↑정규직,경기전체,"C언어, MFC, OpenCV, C++, S/W 외 수정일 22/09/26",https://www.saramin.co.kr/zf_user/jobs/relay/view?isMypage=no&rec_idx=44063979
"데이터시각화, RPA, Azure 엔지니어 (신입/경력)",메이븐클라우드서비스(주),"경력무관대졸↑정규직3,700 만원",서울강남구,"유지보수, CSS, 머신러닝, C#, AWS 외 수정일 22/09/28",https://www.saramin.co.kr/zf_user/jobs/relay/view?isMypage=no&rec_idx=44089808
외국계 반도체 엔지니어 RTL ARM Verilog HDL SoC 등,(주)코리아휴먼리소시스,경력3년↑대졸↑정규직,경기성남시 분당구,"C언어, VHDL, ASIC, C++, 아키텍쳐 외 등록일 22/11/17",https://www.saramin.co.kr/zf_user/jobs/relay/view?isMypage=no&rec_idx=44457823
정규직 개발자 모집(모바일/웹/소프트웨어 개발),(주)이지스헬스케어,경력무관학력무관정규직,서울강서구,"API, 유지보수, CSS, C#, PHP 외 등록일 22/10/27",https://www.saramin.co.kr/zf_user/jobs/relay/view?isMypage=no&rec_idx=44299754
반도체 SoC 물리적 구현 엔지니어,(주)코리아휴먼리소시스,경력무관대졸↑정규직,경기성남시 분당구,"C언어, C++, Java, Git, Python 외 등록일 22/11/14",https://www.saramin.co.kr/zf_user/jobs/relay/view?isMypage=no&rec_idx=44430862
[테크사업부] 주니어 백엔드 개발자 (병역특례 가능),매드업,신입·경력대졸↑정규직·전문연구요원,서울서초구,"API, AWS, 백엔드/서버개발, C++, 클라우드 외 수정일 22/11/09",https://www.saramin.co.kr/zf_user/jobs/relay/view?isMypage=no&rec_idx=44330222
iOS 개발자 정규직 채용,(주)서밋코퍼레이션,경력2년↑학력무관정규직,경기안양시 동안구,"Objective-C, 유지보수, C++, iOS, Swift 외 등록일 22/11/01",https://www.saramin.co.kr/zf_user/jobs/relay/view?isMypage=no&rec_idx=44330860
부품 수입 · 해외영업관리 신입/경력사원 채용,지엠테크(주),"신입·경력초대졸↑정규직3,800 만원",서울송파구,"수출입, 무역사무원, 통관, 무역영어, 해외영업 외 수정일 22/11/18",https://www.saramin.co.kr/zf_user/jobs/relay/view?isMypage=no&rec_idx=44452987
[3개월 후 정규직/인텐티브별도] 인아그룹사 홍보실 디자이너,(주)밸류링크코리아,"경력 2~5년초대졸↑계약직·파견직 (정규직 전환가능)3,310 만원",서울금천구,"카탈로그, PhotoShop, 시각디자인, 일러스트레이터, 일러스트 외 수정일 22/11/16",https://www.saramin.co.kr/zf_user/jobs/relay/view?isMypage=no&rec_idx=44446920
(주)트루윈 신입 및 경력사원 모집,(주)트루윈,경력무관고졸↑정규직,대전유성구,"OrCAD, CATIA, C++, CAM, 연구원 외 수정일 22/10/28",https://www.saramin.co.kr/zf_user/jobs/relay/view?isMypage=no&rec_idx=44172867
[아프리카TV] 글로벌 서비스 LIVE 방송 서버 / 미디어 서버 개발,(주)아프리카티비,경력3년↑학력무관정규직,경기성남시 분당구,"API, C언어, 유지보수, C#, PHP 외 등록일 22/11/14",https://www.saramin.co.kr/zf_user/jobs/relay/view?isMypage=no&rec_idx=44430627
[프리랜서] TM 텔레마케터 경력 모집 공고 (재택근무 가능),(주)컨택틱,경력1년↑학력무관프리랜서,서울서초구,"단순안내, 아웃바운드, 텔레마케터, 섭외TM, 상담품질관리 외 수정일 22/09/27",https://www.saramin.co.kr/zf_user/jobs/relay/view?isMypage=no&rec_idx=44072988
서비스운영팀(인바운드) 채용,(주)에스제이더블유인터내셔널,경력무관고졸↑정규직,서울영등포구,"인바운드, 상담원, 콜센터/고객센터, 어학원, 일본어학원 외 등록일 22/11/18",https://www.saramin.co.kr/zf_user/jobs/relay/view?isMypage=no&rec_idx=44458479
텔레세일즈(아웃바운드) 채용,(주)에스제이더블유인터내셔널,경력무관고졸↑정규직,서울영등포구,"CS, 상담원, 전화상담, 아웃바운드, 해피콜 외 등록일 22/11/18",https://www.saramin.co.kr/zf_user/jobs/relay/view?isMypage=no&rec_idx=44458482
"[유니스카이 X NishiAir] 2023년채용설명회&채용면접(부산,서울)",유니스카이 주식회사,"경력무관초대졸↑계약직2,700 이상 (면접 후 협의)",일본오키나와,"카페, 지상직, 공항, 항공사, 관광통역 등록일 22/11/08",https://www.saramin.co.kr/zf_user/jobs/relay/view?isMypage=no&rec_idx=44385338
2022년 하반기 각 부문별 공개 채용,라온피플(주),경력무관학력무관정규직,경기성남시 분당구,"API, CSS, 머신러닝, C#, MFC 외 수정일 22/11/08",https://www.saramin.co.kr/zf_user/jobs/relay/view?isMypage=no&rec_idx=44330181
회로 연구원 모집,실리콘디스플레이㈜,경력무관대졸↑정규직·전문연구요원,경기용인시 기흥구,"LCD, 반도체설계, PCB, 디스플레이, FPGA 외 수정일 22/11/16",https://www.saramin.co.kr/zf_user/jobs/relay/view?isMypage=no&rec_idx=44245166
[시원스쿨] 공무원 영어 강사 채용,(주)에스제이더블유인터내셔널,경력무관대졸↑계약직·프리랜서,서울영등포구,"영어, 원어민강사, 어학원, 학습지, 대학교 외 등록일 22/10/13",https://www.saramin.co.kr/zf_user/jobs/relay/view?isMypage=no&rec_idx=44196143
임베디드 개발자,(주)아이비스,신입·경력고졸↑정규직,경기전체,"C언어, C#, C++, Python, S/W 외 수정일 22/06/21",https://www.saramin.co.kr/zf_user/jobs/relay/view?isMypage=no&rec_idx=43340715
"[상시모집] 인공지능(AI) 모델 개발자 신입, 경력 채용",주식회사 글로벌브릿지,신입·경력대졸↑정규직,인천연수구,"C언어, 머신러닝, OpenCV, C++, Python 외 등록일 22/11/07",https://www.saramin.co.kr/zf_user/jobs/relay/view?isMypage=no&rec_idx=44376460
[삼성역/렌트카 본사/신입가능] 사무보조 직원 채용(복지多),㈜휴먼리소스,경력무관고졸↑파견직 (정규직 전환가능)·파견직,서울강남구,"OA, Excel, 문서작성, 사무보조, 사무직 외 수정일 22/11/16",https://www.saramin.co.kr/zf_user/jobs/relay/view?isMypage=no&rec_idx=44426586
[경력] 영상처리 SW 개발자 모집,(주)엠젠,경력10년↓대졸↑정규직,경기수원시 영통구,"VisualC·C++, C#, MFC, 컴퓨터비전, OpenCV 외 수정일 22/11/14",https://www.saramin.co.kr/zf_user/jobs/relay/view?isMypage=no&rec_idx=44430880
[시원스쿨] 출판 온라인 마케터 채용,(주)에스제이더블유인터내셔널,경력 1~3년초대졸↑정규직,서울영등포구,"SNS마케팅, SNS, 기획, 마케팅, 마케팅기획 외 등록일 22/11/15",https://www.saramin.co.kr/zf_user/jobs/relay/view?isMypage=no&rec_idx=44439593
피부과 미용기기 소프트웨어 경력직 채용,(주)쉬엔비,경력8년↑초대졸↑정규직,서울성동구,"S/W, 임베디드, 펌웨어, Qt, 제조업 회사본사 등록일 22/10/26",https://www.saramin.co.kr/zf_user/jobs/relay/view?isMypage=no&rec_idx=44289968
CM병원 원무행정(접수수납 야간) 직원 모집,CM병원 (CM충무병원),"경력무관초대졸↑정규직2,600 이상 (면접 후 협의)",서울영등포구,"원무, 접수/예약, 종합병원, 전문병원 등록일 22/10/26",https://www.saramin.co.kr/zf_user/jobs/relay/view?isMypage=no&rec_idx=44291819
(주)이루온 프로그램개발(신규/경력) 모집,이루온,경력무관초대졸↑정규직,경기성남시 분당구,"C언어, CPO, 유지보수, VisualC·C++, VisualBasic 외 수정일 22/10/24",https://www.saramin.co.kr/zf_user/jobs/relay/view?isMypage=no&rec_idx=44202100
중화권 해외영업 경력사원 채용,(주)코스니즈,경력3년↑고졸↑정규직,서울송파구,"B2C, 기획, 전략기획, 시장조사, 수출입 외 수정일 22/11/02",https://www.saramin.co.kr/zf_user/jobs/relay/view?isMypage=no&rec_idx=44344006
충방전기 운영 및 제어 SW 개발 코스닥상장사 수원근무,(주)코리아휴먼리소시스,경력3년↑학력무관정규직,경기수원시 권선구,"C언어, 유지보수, C#, MCU, MFC 외 등록일 22/11/14",https://www.saramin.co.kr/zf_user/jobs/relay/view?isMypage=no&rec_idx=44430921
IOS개발 담당자 채용(주 4일 근무),(주)사이넷,경력무관초대졸↑계약직,서울송파구,"Objective-C, 백엔드/서버개발, C++, iOS, Swift 외 등록일 22/10/27",https://www.saramin.co.kr/zf_user/jobs/relay/view?isMypage=no&rec_idx=44299927
회로설계 및 펌웨어 개발 정규직 모집 (기업부설연구소),건아정보기술(주),경력무관초대졸↑정규직,서울송파구,"MCU, 회로설계, 펌웨어, 펌웨어, 전기 외 등록일 22/11/14",https://www.saramin.co.kr/zf_user/jobs/relay/view?isMypage=no&rec_idx=44426835
반도체 DevOps Engineer,(주)코리아휴먼리소시스,경력무관대졸↑정규직,경기성남시 분당구,"C언어, C++, Java, Git, Python 외 등록일 22/11/17",https://www.saramin.co.kr/zf_user/jobs/relay/view?isMypage=no&rec_idx=44457813
"[송파 문정, 안전진단] 출납/회계/관리 경력사원 채용",(주)중부구조안전기술단,경력학력무관정규직·파트,서울송파구,"회계, 회계결산, 법인결산, 경리, 4대보험 외 등록일 22/11/18",https://www.saramin.co.kr/zf_user/jobs/relay/view?isMypage=no&rec_idx=44464512
반도체 Physical Design Engineer,(주)코리아휴먼리소시스,경력무관대졸↑정규직,경기성남시 분당구,"C언어, C++, Java, Git, Python 외 등록일 22/11/17",https://www.saramin.co.kr/zf_user/jobs/relay/view?isMypage=no&rec_idx=44457818
비전 알고리즘 개발자 모집,(주)미르기술,경력 4~20년대졸↑정규직,경기전체,"C언어, 유지보수, 머신러닝, OpenCV, C++ 외 수정일 22/02/23",https://www.saramin.co.kr/zf_user/jobs/relay/view?isMypage=no&rec_idx=42406430
긴급) 디지털 서비스 PMO - 업계 최고 대기업 - 최우대,휴머레인컨설팅,경력3년↑학력무관정규직,서울강남구,"Objective-C, PM(프로젝트매니저), 머신러닝, 리서치, UI/UX 외 등록일 22/11/19",https://www.saramin.co.kr/zf_user/jobs/relay/view?isMypage=no&rec_idx=44467310
플랫폼사업부문 프론트엔트 개발 / 백엔드 개발 / 서비스기획,(주)이엘파크,경력1년↑학력무관정규직,서울마포구,"API, C언어, ReactJS, C#, OracleDB 외 수정일 22/10/12",https://www.saramin.co.kr/zf_user/jobs/relay/view?isMypage=no&rec_idx=44183041
인공지능 연구원 모집,구루넷,경력 2~15년석사↑정규직,서울금천구,"C언어, 머신러닝, C#, MFC, Hadoop 외 등록일 22/11/16",https://www.saramin.co.kr/zf_user/jobs/relay/view?isMypage=no&rec_idx=44444987
모바일 클라이언트 (Unity3D C#),(주)엔스테이지,경력 3~10년학력무관정규직,경기전체,"Objective-C, 유지보수, C#, C++, iOS 외 수정일 22/09/19",https://www.saramin.co.kr/zf_user/jobs/relay/view?isMypage=no&rec_idx=40346789
Inside Sales Specialist (말레이시아 이전),Webhelp,경력 2~5년초대졸↑정규직·해외취업,아시아·중동말레이시아,"기술영업, 기술지원, Windows, 기업영업, 고객관리 외 등록일 22/11/17",https://www.saramin.co.kr/zf_user/jobs/relay/view?isMypage=no&rec_idx=44457219
자동차 전장부품 S/W 설계 신입 경력 채용,동아전기부품(주),경력무관초대졸↑정규직,경기화성시,"C언어, MCU, S/W, 임베디드, 펌웨어 외 등록일 22/11/15",https://www.saramin.co.kr/zf_user/jobs/relay/view?isMypage=no&rec_idx=44436758
[(주)브이브이알] Unity 개발자 모집(경력),(주)브이브이알,경력2년↑학력무관정규직,서울송파구,"C언어, VisualC·C++, VisualBasic, C++, Git 외 등록일 22/11/15",https://www.saramin.co.kr/zf_user/jobs/relay/view?isMypage=no&rec_idx=44440174
[자동차부품 기업] 정보시스템 개발 및 운영요원 모집,구루넷,경력 3~15년초대졸↑정규직,충북진천군,"C언어, OracleDB, C++, MES, Java 외 등록일 22/11/16",https://www.saramin.co.kr/zf_user/jobs/relay/view?isMypage=no&rec_idx=44445588
"[경력]자사몰, 상세페이지 제작 웹디자이너 모집",(주)에이치비글로벌,경력3년↑학력무관정규직,경기파주시,"PhotoShop, 시각디자인, 일러스트레이터, 일러스트, 웹디자인 외 수정일 22/11/17",https://www.saramin.co.kr/zf_user/jobs/relay/view?isMypage=no&rec_idx=44191470
(주)라스칼라코리아 기술엔지니어 정규직 채용 (기술부 2명),주식회사 라스칼라코리아,경력무관초대졸↑정규직,경기용인시 기흥구,"기술엔지니어, 설계엔지니어, 엔지니어, 환경, 수질환경 등록일 22/11/07",https://www.saramin.co.kr/zf_user/jobs/relay/view?isMypage=no&rec_idx=44372933
소프트웨어 응용프로그래머(C#) 신입 및 경력사원 모집합니다.,(주)에이치앤에스,경력무관초대졸↑정규직,서울금천구,"VisualC·C++, PLC, C#, VisualBasic, HMI 외 등록일 22/11/15",https://www.saramin.co.kr/zf_user/jobs/relay/view?isMypage=no&rec_idx=44432485
안드로이드 개발자 모집 (앱 웹),(주)에버정보기술,"신입·경력학력무관정규직2,800 이상 (면접 후 협의)",대전유성구,"C#, C++, Android, 앱개발, 웹개발 외 등록일 22/11/18",https://www.saramin.co.kr/zf_user/jobs/relay/view?isMypage=no&rec_idx=44462857
(주)씨어스테크놀로지 채용 ( 사업본부 ),(주)씨어스테크놀로지,경력무관대졸↑정규직,경기성남시 분당구,"CSS, MFC, Javascript, 클라우드, 영업 외 등록일 22/10/26",https://www.saramin.co.kr/zf_user/jobs/relay/view?isMypage=no&rec_idx=44295925
(주)우진기전 시스템 설계 및 펌웨어 개발 신입 및 경력 모집,(주)우진기전,경력무관초대졸↑정규직,충북괴산군,"C언어, PLC, 인터페이스, Windows, 회로설계 외 수정일 22/10/27",https://www.saramin.co.kr/zf_user/jobs/relay/view?isMypage=no&rec_idx=44062519
[이화여대] 이화실험동물센터 실험동물 사육관리직원 모집,이화여자대학교 실험동물유전체연구센터,경력무관고졸↑기간제·계약직,서울서대문구,"연구원, 생명과학, 동물실험, 동물관리, 교육기관 외 등록일 22/11/18",https://www.saramin.co.kr/zf_user/jobs/relay/view?isMypage=no&rec_idx=44461969
[국제피부연구센터] 브랜드 디자이너 채용공고,국제피부연구센터,신입·경력학력무관정규직,경기화성시,"GUI, 시각디자인, 산업디자인, 브랜드디자인, 광고디자인 외 수정일 22/11/09",https://www.saramin.co.kr/zf_user/jobs/relay/view?isMypage=no&rec_idx=44393526
"온라인 마케팅팀 바이럴마케팅,블로그마케터 - 신입/경력자 모집",(주)퍼스트마케팅컴퍼니,경력무관초대졸↑정규직·기간제,대구동구,"IMC, 마케팅, 마케팅기획, 마케팅전략, 홍보 외 등록일 22/10/24",https://www.saramin.co.kr/zf_user/jobs/relay/view?isMypage=no&rec_idx=44270667
[서울/강남] 펌웨어 개발 경력자,WICKY AID,경력1년↑대졸↑정규직,서울강남구,"C언어, MCU, C++, 임베디드, 알고리즘 외 등록일 22/11/15",https://www.saramin.co.kr/zf_user/jobs/relay/view?isMypage=no&rec_idx=44438827
개발 리드,(주)피어테크,경력 3~8년대졸↑정규직,서울전체,"API, C언어, 머신러닝, ISMS, ECMAScript 외 수정일 22/10/28",https://www.saramin.co.kr/zf_user/jobs/relay/view?isMypage=no&rec_idx=42687599
국내1위 아파트B2C서비스기업 UX/UI 기획부문(3-8년),(주)에이치알비즈코리아,경력 3~8년초대졸↑정규직,서울금천구,"UI/UX, 기획, 솔루션업체, 소프트웨어개발 수정일 22/11/17",https://www.saramin.co.kr/zf_user/jobs/relay/view?isMypage=no&rec_idx=44442028
[아이디병원] 아이디클리닉 마케팅담당자 채용,아이디헬스케어그룹,경력초대졸↑정규직,서울강남구,"마케팅, 마케팅기획, 마케팅전략, 콘텐츠마케팅, 병원·진료 외 등록일 22/11/10",https://www.saramin.co.kr/zf_user/jobs/relay/view?isMypage=no&rec_idx=44406105
[정규직/주5일/연봉3000] 의류 물류/재고 관리 모집 / 운전안함,(주)에브리데이해피,"경력무관학력무관정규직3,000 (면접 후 협의)",경기의정부시,"재고관리, 물류관리, 창고관리, 출고/출하, 유통관리 외 수정일 22/11/17",https://www.saramin.co.kr/zf_user/jobs/relay/view?isMypage=no&rec_idx=44267626
법무법인(유한) 대륜 수원사무소 법률비서 모집,법무법인(유)대륜,"경력무관초대졸↑정규직3,000 (면접 후 협의)",경기수원시 영통구,"법률사무원, 문서작성, 사무보조, 사무직, 고객응대 외 수정일 22/11/18",https://www.saramin.co.kr/zf_user/jobs/relay/view?isMypage=no&rec_idx=44235663
클라우드 보안 플랫폼 기술지원 신입/경력 채용,(주)모니터랩,신입·경력초대졸↑정규직,서울구로구,"Objective-C, API, C언어, 유지보수, CSS 외 수정일 22/11/15",https://www.saramin.co.kr/zf_user/jobs/relay/view?isMypage=no&rec_idx=43962876
[트라이얼코리아] 마케터 인재채용 (마케팅 업무 유경험자 우대),(주)트라이얼코리아,"경력무관초대졸↑정규직2,800 이상 (면접 후 협의)",부산해운대구,"SNS마케팅, SNS, 마케팅, 마케팅기획, 마케팅전략 외 등록일 22/11/12",https://www.saramin.co.kr/zf_user/jobs/relay/view?isMypage=no&rec_idx=44416722
금융시스템 유지보수,탑커리어인사이트,경력 2~10년대졸↑정규직,서울중구,"유지보수, Java, SQL, SI·시스템통합 수정일 22/11/18",https://www.saramin.co.kr/zf_user/jobs/relay/view?isMypage=no&rec_idx=44441103
패키지디자인 상세페이지 & 컨텐츠 디자이너 (대기업 협력사),디자인포레,경력3년↑대졸↑정규직,서울송파구,"SNS, 시각디자인, 편집디자인, 상세페이지, 3D디자인 외 수정일 22/11/02",https://www.saramin.co.kr/zf_user/jobs/relay/view?isMypage=no&rec_idx=44341403
안전시설물 및 안전망 설치/해체 정규직 채용합니다(경력무관),에이치케이안전시스템(주),경력무관학력무관정규직340 만원,경기남양주시,"현장관리자, 현장기사, 건설회사 수정일 22/11/10",https://www.saramin.co.kr/zf_user/jobs/relay/view?isMypage=no&rec_idx=44247187
매장판매직 정규직 채용(청담점),(주)한국금거래소쓰리엠,신입·경력학력무관정규직,서울강남구,"매장관리, 귀금속판매, 판매, 잡화매장 수정일 22/11/03",https://www.saramin.co.kr/zf_user/jobs/relay/view?isMypage=no&rec_idx=44352014
한국건강관리협회 경기도지부 간호사/임상병리사 채용,(사)한국건강관리협회경기도지부,경력무관학력무관기간제·계약직,경기수원시 장안구,"간호사, 방사선사, 임상병리사, 간호조무사, 영상의학과 외 등록일 22/11/18",https://www.saramin.co.kr/zf_user/jobs/relay/view?isMypage=no&rec_idx=44462935
[EY한영] 세무본부 GCR 서비스 경력직 모집,한영회계법인,경력대졸↑정규직·계약직,서울영등포구,"세무사, 회계, 세무회계, 세무신고, 세무조정 외 수정일 22/11/10",https://www.saramin.co.kr/zf_user/jobs/relay/view?isMypage=no&rec_idx=44395789
STB Platform SW 개발 경력 모집,(주)휴맥스네트웍스,경력 2~10년대졸↑정규직,경기성남시 분당구,"C언어, C++, Android, S/W, Linux 외 수정일 22/10/26",https://www.saramin.co.kr/zf_user/jobs/relay/view?isMypage=no&rec_idx=44289113
[]프랑스 가죽 브랜드 [] 머천다이저 MD,에이치알포유(주),경력2년↑대졸↑정규직,서울강남구,"리테일MD, 기획MD, 유통MD, 브랜드MD, 영업MD 외 등록일 22/11/18",https://www.saramin.co.kr/zf_user/jobs/relay/view?isMypage=no&rec_idx=44462971
[조선영상비전] 방송기술부 부조정실 조명 신입 채용,조선영상비전,신입초대졸↑정규직,서울중구,"조명, 방송송출, 종합유선방송, 미디어 등록일 22/11/07",https://www.saramin.co.kr/zf_user/jobs/relay/view?isMypage=no&rec_idx=44378681
2022 토목 안전진단부 경력무관 채용 공고(내일채움공제 지원),(주)대한구조컨설턴트,"경력무관초대졸↑정규직3,200 만원",경기하남시,"QC, CAD, 시설관리, 안전관리자, 토목공사 외 수정일 22/10/31",https://www.saramin.co.kr/zf_user/jobs/relay/view?isMypage=no&rec_idx=44191257
