Title,Corp,Condition,Location,Tag,Link
화장품 브랜드 마케터 정규직 직원 모십니다.,에이치컴바인드(주),신입·경력학력무관정규직,서울강남구,"IMC, 마케팅, 브랜드마케팅, 전자상거래 등록일 22/11/18",https://www.saramin.co.kr/zf_user/jobs/relay/view?isMypage=no&rec_idx=44464531
[더블엑스코퍼레이션] 영상팀 컨텐츠 영상팀 영상편집 PD 정규직,(주)더블엑스코퍼레이션,경력무관학력무관정규직,경기성남시 수정구,"영상편집, 영상제작, 촬영, 영상자막, 조명 외 등록일 22/11/17",https://www.saramin.co.kr/zf_user/jobs/relay/view?isMypage=no&rec_idx=44457001
[중견코스닥] 프리커서 합성 개발 경력직,커리어서포트,경력3년↑석사↑정규직,서울금천구,"연구원, 기술연구, 신소재, 반도체, 반도체 등록일 22/11/18",https://www.saramin.co.kr/zf_user/jobs/relay/view?isMypage=no&rec_idx=44460766
산업용 설비 전기설비/유지보수 팀장급 경력직,페리투스이큅먼트(주),"경력고졸↑정규직5,000 만원",경기하남시,"PLC, 파쇄기/분쇄기, 전기설비, 환경플랜트, 메카트로닉스 외 등록일 22/09/23",https://www.saramin.co.kr/zf_user/jobs/relay/view?isMypage=no&rec_idx=44058757
[중견코스닥]  전략기획팀장 모집,커리어서포트,경력10년↑대졸↑정규직,서울금천구,"기획, 전략기획, 사업기획, M&A, 시장조사 외 등록일 22/11/18",https://www.saramin.co.kr/zf_user/jobs/relay/view?isMypage=no&rec_idx=44460798
HRM담당/국내대기업/2년이상,(주)커리어앤유,경력 2~8년대졸↑정규직,경기성남시 분당구,"HRM, 인사, 평가/보상, 복리후생, 서치펌 등록일 22/11/18",https://www.saramin.co.kr/zf_user/jobs/relay/view?isMypage=no&rec_idx=44465926
"시스템엔지니어 경력, 신입 채용합니다 - 정규직",인콤정보통신(주),신입·경력초대졸↑정규직,서울구로구,"유지보수, C#, C++, 솔루션, 네트워크 외 등록일 22/09/23",https://www.saramin.co.kr/zf_user/jobs/relay/view?isMypage=no&rec_idx=44055279
평일 주 1회 off)목동튼튼통증의학과에서 방사선사선생님 구인,목동튼튼마취통증의학과,경력무관초대졸↑정규직,서울양천구,"방사선사, 병원·진료, 정형외과 등록일 22/11/18",https://www.saramin.co.kr/zf_user/jobs/relay/view?isMypage=no&rec_idx=44461471
HR 평가보상담당/8년이상/그룹계열사,(주)커리어앤유,경력 8~15년대졸↑정규직,서울서초구,"인사, 인사기획, 평가/보상, 서치펌 등록일 22/11/18",https://www.saramin.co.kr/zf_user/jobs/relay/view?isMypage=no&rec_idx=44465955
Account Manager/IT Sales   (현대그룹 담당),(주)에이치티엘엠에이치알,경력 10~20년대졸↑정규직,경기성남시 분당구,"영업, SI영업, 서치펌, 헤드헌팅 등록일 22/11/18",https://www.saramin.co.kr/zf_user/jobs/relay/view?isMypage=no&rec_idx=44461809
[후루츠패밀리] Back-end Developer 백엔드 서버 개발자 (경력),(주)후루츠패밀리컴퍼니,경력6년↑학력무관정규직,서울용산구,"AWS, 백엔드/서버개발, TypeScript, Javascript, React 외 수정일 22/10/06",https://www.saramin.co.kr/zf_user/jobs/relay/view?isMypage=no&rec_idx=44146914
외국계 화학기업 SCM/영어가능/계약직,(주)커리어앤유,경력2년↑학력무관기간제·계약직,서울강남구,"CS, SCM, SAP, 서치펌 등록일 22/11/18",https://www.saramin.co.kr/zf_user/jobs/relay/view?isMypage=no&rec_idx=44466152
[법무법인태하] 송도지사 송무(경력직)채용,법무법인태하,경력무관학력무관정규직,인천연수구,"변호사, 법무법인 수정일 22/11/01",https://www.saramin.co.kr/zf_user/jobs/relay/view?isMypage=no&rec_idx=44147880
Data Scientist - Signal Processing (전문연구요원 가능),(주)원프레딕트,경력 2~10년대졸↑정규직,서울전체,"OracleDB, Spark, Hadoop, C++, 클라우드 외 수정일 22/11/08",https://www.saramin.co.kr/zf_user/jobs/relay/view?isMypage=no&rec_idx=41895145
식품제조업체 생산직 모집,라이스파이,경력무관학력무관정규직270 만원,경기성남시 중원구,"Haccp, 제조, 생산, 단순생산직, 포장 외 등록일 22/11/18",https://www.saramin.co.kr/zf_user/jobs/relay/view?isMypage=no&rec_idx=44459779
"두리시스템-기계설비, 설계업무 담당자",두리시스템,경력무관학력무관정규직,경기안산시 단원구,"CAD, CAM, 3D디자인, CAD, 제조 외 수정일 22/10/20",https://www.saramin.co.kr/zf_user/jobs/relay/view?isMypage=no&rec_idx=44058652
TM 상담업무 / 신입 경력사원 환영 / 인천시청앞 / 3명,(주)제이티컴퍼니,신입·경력고졸↑정규직·아르바이트,인천남동구,"콜센터/고객센터, 아웃바운드, 복권발행 등록일 22/11/18",https://www.saramin.co.kr/zf_user/jobs/relay/view?isMypage=no&rec_idx=44460803
[4.5일제][슈프리마그룹 슈프리마HQ] SW 개발자 모집,(주)슈프리마,경력2년↑대졸↑정규직,경기성남시 분당구,"C++, iOS, Android, Java, Linux 외 수정일 22/10/22",https://www.saramin.co.kr/zf_user/jobs/relay/view?isMypage=no&rec_idx=44075356
[바이오코스닥] 브랜드전략팀 대리-과장급 모집,커리어서포트,경력4년↑대졸↑정규직,서울금천구,"마케팅, 건강보조식품, 바이오 등록일 22/11/18",https://www.saramin.co.kr/zf_user/jobs/relay/view?isMypage=no&rec_idx=44460739
경영마케팅실의 경리회계(사무직) 경력 신입을 모집합니다.,㈜지트파워,경력무관학력무관정규직,서울금천구,"전산회계, 바이럴마케팅, 경리, 경리사무원, 솔루션업체 외 수정일 22/10/18",https://www.saramin.co.kr/zf_user/jobs/relay/view?isMypage=no&rec_idx=44109168
부동산솔루션 영업지원 신입 경력 모집,㈜지트파워,경력무관학력무관정규직,서울금천구,"OracleDB, Java, 솔루션업체, 소프트웨어개발, SM 수정일 22/10/24",https://www.saramin.co.kr/zf_user/jobs/relay/view?isMypage=no&rec_idx=44058439
메디칼 전문 (주)유티비 영업 경력 / 신입사원 채용 [정규직원],(주)유티비,경력무관초대졸↑정규직,경기성남시 중원구,"영업, 영업직, 수출입, 판매 수정일 22/11/10",https://www.saramin.co.kr/zf_user/jobs/relay/view?isMypage=no&rec_idx=44140162
(주)티오더 강남구 Front-End 엔지니어링 매니저/테크리드 채용,(주)티오더,경력 5~7년대졸↑정규직,서울강남구,"CSS, C++, React, Android, 프론트엔드 외 수정일 22/11/09",https://www.saramin.co.kr/zf_user/jobs/relay/view?isMypage=no&rec_idx=44077563
America e-commerce expert (preferred English native speaker),(주)와드인터내셔널,경력학력무관계약직,서울강서구,"SNS마케팅, SNS, B2C, 마케팅, 온라인MD 외 수정일 22/10/28",https://www.saramin.co.kr/zf_user/jobs/relay/view?isMypage=no&rec_idx=44145277
산업용 설비 전기설비/유지보수 정규직 경력직,페리투스이큅먼트(주),"경력고졸↑정규직4,500 만원",경기하남시,"PLC, 파쇄기/분쇄기, 전기설비, 환경플랜트, 메카트로닉스 외 등록일 22/09/23",https://www.saramin.co.kr/zf_user/jobs/relay/view?isMypage=no&rec_idx=44058862
시니어 백엔드 개발자 (Sr. Backend Engineer),(주)원프레딕트,경력 4~10년학력무관정규직,서울전체,"API, 백엔드/서버개발, C++, Java, 웹개발 외 수정일 22/09/06",https://www.saramin.co.kr/zf_user/jobs/relay/view?isMypage=no&rec_idx=43829017
[경영지원팀] 재무/총무 모집,(주)소풍인터내셔널,경력1년↑고졸↑정규직,서울강동구,"재무, 총무, 비품관리, 자산관리, 할인점 외 등록일 22/11/18",https://www.saramin.co.kr/zf_user/jobs/relay/view?isMypage=no&rec_idx=44461502
반도체 Test Engineer,비전서치,경력 2~14년대졸↑정규직,서울송파구,"반도체, 디스플레이, 반도체, 디스플레이, LED·AMOLED 등록일 22/11/19",https://www.saramin.co.kr/zf_user/jobs/relay/view?isMypage=no&rec_idx=44466810
네트워크 및 보안 신입/경력 엔지니어 모집합니다.,(주)코어인프라,경력무관학력무관정규직,경기의왕시,"정보보안, 네트워크, 기술지원, 방화벽, VPN 외 수정일 22/11/18",https://www.saramin.co.kr/zf_user/jobs/relay/view?isMypage=no&rec_idx=44204879
iOS 개발자 경력직 모집,(주)골프존데카,경력 6~12년학력무관정규직,경기전체,"Objective-C, C++, iOS, Swift, 앱개발 외 등록일 22/07/12",https://www.saramin.co.kr/zf_user/jobs/relay/view?isMypage=no&rec_idx=43506858
경력직 개발자 모집(프론트엔드/풀스택/ APP/SW/IT인프라),주식회사 엔젠바이오,경력 3~10년대졸↑정규직,서울구로구,"API, CSS, C#, 백엔드/서버개발, GCP 외 수정일 22/11/08",https://www.saramin.co.kr/zf_user/jobs/relay/view?isMypage=no&rec_idx=44136100
[정규직] 기술영업팀 실험실 검사장비 및 의료기기 기술영업지원,(주)바이오메드,경력무관초대졸↑정규직,경기성남시 분당구,"유지보수, 제약/바이오, 기술영업, 식품, 네트워크 외 수정일 22/09/30",https://www.saramin.co.kr/zf_user/jobs/relay/view?isMypage=no&rec_idx=44106233
(주)성훈레미콘 경리판매사무원 모집합니다,(주)성훈철강,경력무관초대졸↑정규직·계약직,경남진주시,"경리, 전표입력, 철강 등록일 22/10/22",https://www.saramin.co.kr/zf_user/jobs/relay/view?isMypage=no&rec_idx=44265963
생산가공부문(  세척 및 후처리 업무),(주)워랜텍,경력무관학력무관계약직,경기성남시 중원구,"조립, 제조가공, 기타제조업 수정일 22/11/10",https://www.saramin.co.kr/zf_user/jobs/relay/view?isMypage=no&rec_idx=44203104
[경력] Backend Engineer,(주)알체라,경력 3~6년학력무관정규직,경기전체,"API, AWS, 백엔드/서버개발, SaaS, 클라우드 외 수정일 22/10/05",https://www.saramin.co.kr/zf_user/jobs/relay/view?isMypage=no&rec_idx=43582124
[TmaxTibero/R&D] DBMS Engine 개발자,(주)티맥스소프트,경력무관대졸↑정규직,경기성남시 분당구,"MySQL, R, 알고리즘, SQL, DBMS 외 수정일 22/10/27",https://www.saramin.co.kr/zf_user/jobs/relay/view?isMypage=no&rec_idx=44302557
모바일 앱 보안 솔루션 개발 - 사이버 보안 벤처기업,(주)스틸리언,경력무관학력무관정규직,서울용산구,"유지보수, C++, 클라우드, iOS, Android 외 수정일 22/10/12",https://www.saramin.co.kr/zf_user/jobs/relay/view?isMypage=no&rec_idx=44072050
태양광 시스템 MLPE 인베디드 엔지니어 모집,퍼스트실리콘(주),경력5년↑대졸↑정규직,서울금천구,"C++, S/W, 임베디드, 알고리즘, 펌웨어 외 등록일 22/11/17",https://www.saramin.co.kr/zf_user/jobs/relay/view?isMypage=no&rec_idx=44456911
더에르고 중국 무역(수입) 업무 담당자 모집,(주)에르모어,신입고졸↑정규직·계약직,경기용인시 처인구,"영업, 생산, 생산관리, 무역사무원, 무역거래 외 수정일 22/10/24",https://www.saramin.co.kr/zf_user/jobs/relay/view?isMypage=no&rec_idx=44269427
IOS 서비스 / Mac 신입/경력 사원 채용,(주)모니터랩,신입·경력초대졸↑정규직,서울구로구,"Objective-C, 유지보수, C++, MacOS, iOS 외 수정일 22/11/15",https://www.saramin.co.kr/zf_user/jobs/relay/view?isMypage=no&rec_idx=43962829
"머신비전 [기술지원, 기술영업] 신입 및 경력 모집",㈜씽크론,경력무관초대졸↑정규직,서울구로구,"API, C언어, 유지보수, VisualC·C++, PLC 외 등록일 22/11/18",https://www.saramin.co.kr/zf_user/jobs/relay/view?isMypage=no&rec_idx=44459731
2022 (주)다솔 인사팀(신입/경력) 채용,농업회사법인(주)다솔,신입·경력학력무관계약직,광주남구,"인사, 식품가공 수정일 22/11/04",https://www.saramin.co.kr/zf_user/jobs/relay/view?isMypage=no&rec_idx=44145245
(주)펠릭스테크 금속 가공직(CNC) 운영 경력직 채용,(주)펠릭스테크,"경력2년↑고졸↑정규직4,400 만원",부산강서구,"주조/단조, 금속, 금속 수정일 22/11/17",https://www.saramin.co.kr/zf_user/jobs/relay/view?isMypage=no&rec_idx=44454069
[플랜티엠] - 영상 및 콘텐츠 디자인 계약직 채용(충원),(주)플랜티엠,경력무관초대졸↑계약직,경기성남시 분당구,"애프터이펙트, PhotoShop, 모션그래픽, 일러스트레이터, 일러스트 외 수정일 22/11/07",https://www.saramin.co.kr/zf_user/jobs/relay/view?isMypage=no&rec_idx=44357167
[빅픽처팀] 아트팀 2D 애니메이터 채용,(주)빅픽처팀,경력무관학력무관정규직,서울강남구,"PhotoShop, 원화, 애니메이터, 만화/웹툰, 2D디자인 외 등록일 22/11/03",https://www.saramin.co.kr/zf_user/jobs/relay/view?isMypage=no&rec_idx=44353387
"[하반기] Microsoft 시스템 엔지니어 (Server, Microsoft 365)",씨앤토트㈜,경력무관학력무관정규직,서울서초구,"유지보수, 클라우드, 솔루션, 네트워크, 기술지원 외 등록일 22/10/04",https://www.saramin.co.kr/zf_user/jobs/relay/view?isMypage=no&rec_idx=44118892
[칠석의료재단] 사랑의병원 본관 영상의학 방사선사 모집,(의료)칠석의료재단,경력무관초대졸↑정규직,경기안산시 상록구,"방사선사, 영상의학과, 당직, 종합병원 수정일 22/10/28",https://www.saramin.co.kr/zf_user/jobs/relay/view?isMypage=no&rec_idx=44218541
[슈프리마AI] 얼굴인식/비디오 분석 인공지능 소프트웨어 개발자,(주)슈프리마,경력2년↑대졸↑정규직,경기성남시 분당구,"API, 컴퓨터비전, 크롤링, C++, 클라우드 외 수정일 22/11/13",https://www.saramin.co.kr/zf_user/jobs/relay/view?isMypage=no&rec_idx=44265455
이카운트 웹메일(mail)개발 경력채용,(주)이카운트,경력2년↑학력무관정규직,서울구로구,"유지보수, VisualC·C++, C#, 백엔드/서버개발, TypeScript 외 등록일 22/11/10",https://www.saramin.co.kr/zf_user/jobs/relay/view?isMypage=no&rec_idx=44405152
워터마크 제품 개발팀장,잉카엔트웍스,경력10년↑학력무관정규직,서울강남구,"API, 컴퓨터비전, C++, SaaS, 클라우드 외 수정일 22/10/12",https://www.saramin.co.kr/zf_user/jobs/relay/view?isMypage=no&rec_idx=44187821
웹 에이전시 [기업컨설턴트] 모집,(주)컨설트인사이드,경력무관학력무관정규직,서울금천구,"기획, 웹기획, 기업컨설턴트, 웹에이전시 등록일 22/11/18",https://www.saramin.co.kr/zf_user/jobs/relay/view?isMypage=no&rec_idx=44462843
"(연봉3840/연장,휴일수당 별도지급) 영업지원팀&영업팀 모집",(주)동일판매,"경력무관초대졸↑정규직·계약직3,840 만원",서울송파구,"영업, 기술영업, 영업관리, 영업직, 영업지원 외 수정일 22/10/28",https://www.saramin.co.kr/zf_user/jobs/relay/view?isMypage=no&rec_idx=44303357
기술영업종합사업부 신규 및 경력자 채용공고(대전),(주)대한과학,"신입·경력대졸↑정규직3,000 (면접 후 협의)",대전대덕구,"기술영업, 장비영업, 거래처납품, 정비기사, 렌탈 외 등록일 22/11/07",https://www.saramin.co.kr/zf_user/jobs/relay/view?isMypage=no&rec_idx=44380020
전력전자 엔지니어 및 기구설계 채용 공고(경력/신입),(주)이지트로닉스,신입·경력초대졸↑정규직·전문연구요원,경기화성시,"임베디드, H/W, 펌웨어, 전력전자, 회로설계 외 수정일 22/10/31",https://www.saramin.co.kr/zf_user/jobs/relay/view?isMypage=no&rec_idx=44049596
소프트웨어 개발자 채용,(주)엠투아이코퍼레이션,신입·경력대졸↑정규직,경기전체,"C언어, 유지보수, C++, S/W, Linux 외 수정일 22/11/15",https://www.saramin.co.kr/zf_user/jobs/relay/view?isMypage=no&rec_idx=42993855
iOS 개발자 채용,(주)다이얼커뮤니케이션즈,경력무관학력무관정규직,서울강서구,"Objective-C, C++, iOS, 앱개발, 통신 외 등록일 22/11/15",https://www.saramin.co.kr/zf_user/jobs/relay/view?isMypage=no&rec_idx=44434263
[셀메드사업부] 영업지원(CS)/출고/학술 정규직 채용,(주)제이비케이랩,경력무관학력무관정규직,경기성남시 중원구,"CS, 영업, 영업관리, 영업지원, 기획 외 수정일 22/10/26",https://www.saramin.co.kr/zf_user/jobs/relay/view?isMypage=no&rec_idx=44295854
유명 미디어제작사 [ 엔진/그래픽스 프로그래머 ] 실무,(주)스카우트,경력 1~15년대졸↑정규직,서울강남구,"C++, 솔루션, OpenGL, Unity, Unreal 외 등록일 22/11/16",https://www.saramin.co.kr/zf_user/jobs/relay/view?isMypage=no&rec_idx=44448619
[경력] DevOps Engineer,(주)알체라,경력 2~6년학력무관정규직,경기전체,"AWS, 백엔드/서버개발, 클라우드, Java, 웹개발 외 등록일 22/11/11",https://www.saramin.co.kr/zf_user/jobs/relay/view?isMypage=no&rec_idx=44408316
전력변환 제어기 개발,슈어소프트테크(주),경력 2~7년초대졸↑정규직,서울전체,"C언어, 머신러닝, AUTOSAR, C++, S/W 외 수정일 21/12/01",https://www.saramin.co.kr/zf_user/jobs/relay/view?isMypage=no&rec_idx=41424818
S/W 개발 연구원 모집,(주)에스피에스,"경력무관대졸↑정규직3,200 만원",대전유성구,"Objective-C, R&D, 머신러닝, AI(인공지능), C++ 외 등록일 22/11/15",https://www.saramin.co.kr/zf_user/jobs/relay/view?isMypage=no&rec_idx=44431450
기획 마케팅 신입경력 모집,㈜지트파워,경력무관학력무관정규직,서울금천구,"마케팅, 마케팅기획, 영업마케팅, 솔루션업체, 소프트웨어개발 외 수정일 22/10/24",https://www.saramin.co.kr/zf_user/jobs/relay/view?isMypage=no&rec_idx=44057830
[지니웍스] 광고 마케팅 플랫폼 디자이너 채용,(주)지니웍스,경력무관학력무관정규직,서울강남구,"일러스트레이터, 웹디자인, 그래픽디자인, 캐릭터디자인, 광고디자인 외 수정일 22/11/17",https://www.saramin.co.kr/zf_user/jobs/relay/view?isMypage=no&rec_idx=44380075
SW 검증 (미래차검증전략 검증),슈어소프트테크(주),경력 2~7년초대졸↑정규직,서울전체,"C언어, C++, S/W, S/W, 소프트웨어개발 수정일 22/02/09",https://www.saramin.co.kr/zf_user/jobs/relay/view?isMypage=no&rec_idx=41424707
회로 설계 및 PCB Artwork 개발자 (대전),프리시젼바이오(주),신입·경력대졸↑정규직,대전전체,"C언어, VHDL, OrCAD, PCB, C++ 외 수정일 22/05/31",https://www.saramin.co.kr/zf_user/jobs/relay/view?isMypage=no&rec_idx=42922133
[루미르] 재무·회계·세무 정규직 경력 모집,루미르(주),경력 5~15년대졸↑정규직,경기용인시 수지구,"IFRS, IPO, 재무, 회계, 재무회계 외 등록일 22/11/10",https://www.saramin.co.kr/zf_user/jobs/relay/view?isMypage=no&rec_idx=44405750
"iOS 앱 개발, 의료기기, 블루투스기기, MQTT, 서버등 연동",(주)초이스테크놀로지,신입·경력초대졸↑정규직,인천전체,"Objective-C, C++, iOS, Swift, 앱개발 외 수정일 22/11/08",https://www.saramin.co.kr/zf_user/jobs/relay/view?isMypage=no&rec_idx=44207250
무역 코레스 신입사원 모집,㈜진영약품,"신입대졸↑정규직3,100 만원",서울강남구,"수출입, 무역사무원, 무역영어, 선적, 무역중개인 외 등록일 22/10/18",https://www.saramin.co.kr/zf_user/jobs/relay/view?isMypage=no&rec_idx=44235131
FPGA HDL 설계 신입 & 경력 모집,(주)엘트로닉스,경력무관초대졸↑정규직,경기수원시 권선구,"C++, FPGA, Verilog, Firmware 등록일 22/11/04",https://www.saramin.co.kr/zf_user/jobs/relay/view?isMypage=no&rec_idx=44358539
(주)성훈철강  출하부 기사직 모집합니다,(주)성훈철강,경력무관고졸↑정규직·계약직,경남진주시,"제조, 제조가공, 단순생산직, 제조업 회사본사 등록일 22/10/25",https://www.saramin.co.kr/zf_user/jobs/relay/view?isMypage=no&rec_idx=44287985
"[온라인] CS 팀원 채용, 쇼핑몰 전화상담, 고객관리, 강동 사옥",(주)소풍인터내셔널,경력무관초대졸↑정규직,서울강동구,"Excel, CS, 사무보조, 고객관리, 상담원 외 등록일 22/11/18",https://www.saramin.co.kr/zf_user/jobs/relay/view?isMypage=no&rec_idx=44461487
브랜드 매니저 채용,(주)펄송,신입·경력고졸↑정규직,서울서초구,"마케팅, 마케팅기획, 마케팅전략, 브랜드마케팅, 쇼핑몰 외 수정일 22/10/26",https://www.saramin.co.kr/zf_user/jobs/relay/view?isMypage=no&rec_idx=44293951
[시원스쿨] 시스템관리자(SE) 채용,(주)에스제이더블유인터내셔널,경력 1~3년학력무관정규직,서울영등포구,"C++, 클라우드, 솔루션, 네트워크, SE(시스템엔지니어) 외 등록일 22/11/15",https://www.saramin.co.kr/zf_user/jobs/relay/view?isMypage=no&rec_idx=44439467
[용인] 르노코리아자동차 중앙연구소 재무본부 사무직 채용,동호에이치알(주),"경력무관대졸↑계약직·인턴직2,970 이상 (면접 후 협의)",경기용인시 기흥구,"Excel, 비서, 재무, 회계, 재무회계 외 등록일 22/11/09",https://www.saramin.co.kr/zf_user/jobs/relay/view?isMypage=no&rec_idx=44398544
[경력] Project 사무 행정 지원,(주)알체라,경력 1~4년학력무관계약직,경기성남시 분당구,"사무보조, 사무행정, 인사, 인력관리, 소프트웨어개발 등록일 22/11/18",https://www.saramin.co.kr/zf_user/jobs/relay/view?isMypage=no&rec_idx=44465976
[주35H/탄력] AI 영상처리 기반 인식 Algorithm 개발자 (경력),(주)에프에스솔루션,경력5년↑석사↑정규직,경기성남시 수정구,"C언어, 머신러닝, OpenCV, C++, Python 외 수정일 22/11/18",https://www.saramin.co.kr/zf_user/jobs/relay/view?isMypage=no&rec_idx=44320773
[청년친화 강소기업] 케이웨더㈜ 대표이사 비서 채용,케이웨더㈜,경력무관학력무관정규직,서울구로구,"비서, 문서작성, 임원비서, 수행비서, 내방객응대 외 등록일 22/11/03",https://www.saramin.co.kr/zf_user/jobs/relay/view?isMypage=no&rec_idx=44356028
자동화장비 PLC 및 PC 자동제어 정규직 - 경력,(주)휴빅스,"경력 3~12년학력무관정규직4,500 만원",경기의왕시,"C언어, PLC, C#, C++, 자동제어 외 등록일 22/11/16",https://www.saramin.co.kr/zf_user/jobs/relay/view?isMypage=no&rec_idx=44444841
[기술연구소] SW/시험/SQA/PM/HW 직군별 하반기 채용모집,(주)모토텍,신입·경력초대졸↑정규직,경기수원시 영통구,"PM(프로젝트매니저), C언어, R&D, R&D기획, PLC 외 수정일 22/11/08",https://www.saramin.co.kr/zf_user/jobs/relay/view?isMypage=no&rec_idx=44174196
화장품  일본 영업 정규직 직원 모십니다.,에이치컴바인드(주),신입·경력학력무관정규직,서울강남구,"영업, 무역영어, 해외영업, 해외시장개척, 해외영업관리 외 수정일 22/11/18",https://www.saramin.co.kr/zf_user/jobs/relay/view?isMypage=no&rec_idx=44464386
[500만의 선택 데이트팝] 부산 정규직 로컬 매니저 모집 (영업),(주)텐핑거스,경력무관학력무관정규직,부산해운대구,"영업, 영업관리, 영업직, 영업기획, 기획 외 수정일 22/10/17",https://www.saramin.co.kr/zf_user/jobs/relay/view?isMypage=no&rec_idx=44125456
더블유아일랜드 마케팅/물류/MD/CX 채용,(주)더블유아일랜드,경력무관학력무관정규직,서울강남구,"CRM마케팅, 주얼리/액세서리, 마케팅, 마케팅기획, 마케팅전략 외 수정일 22/11/11",https://www.saramin.co.kr/zf_user/jobs/relay/view?isMypage=no&rec_idx=44416480
C++ 개발자 모집 (주니어),(주)이파피루스,신입·경력학력무관정규직,경기전체,"C언어, 유지보수, C++, Git, S/W 외 등록일 22/10/12",https://www.saramin.co.kr/zf_user/jobs/relay/view?isMypage=no&rec_idx=44187345
광고기획 AE 경력 채용,(주)미쓰윤,경력 3~12년초대졸↑정규직,서울서초구,"CF광고, IMC, AE(광고기획자), 광고마케팅, 광고기획 외 등록일 22/10/25",https://www.saramin.co.kr/zf_user/jobs/relay/view?isMypage=no&rec_idx=44285077
(주)성훈철강 영업직 모집합니다,(주)성훈철강,경력무관초대졸↑정규직·계약직,경남진주시,"영업직, 철강 등록일 22/10/13",https://www.saramin.co.kr/zf_user/jobs/relay/view?isMypage=no&rec_idx=44190753
(주)그림 머신비전 소프트웨어 프로그래머(C++/MFC) 채용,(주)그림,"경력무관학력무관정규직3,500 만원",경기광명시,"C언어, C#, MFC, 컴퓨터비전, OpenCV 외 수정일 22/11/11",https://www.saramin.co.kr/zf_user/jobs/relay/view?isMypage=no&rec_idx=44284016
BX 브랜드 디자이너 경력직 채용,(주)컨택틱,경력5년↑학력무관정규직,서울서초구,"CRM마케팅, 기획, 마케팅, 브랜드마케팅, 디지털마케팅 외 수정일 22/10/25",https://www.saramin.co.kr/zf_user/jobs/relay/view?isMypage=no&rec_idx=44207997
건대입구역 근처 정형외과 방사선사 1분 구인합니다.,서울에이스정형외과의원,경력무관초대졸↑정규직,서울광진구,"방사선사, 정형외과, 영상의학과, 병원·진료, 정형외과 외 등록일 22/11/18",https://www.saramin.co.kr/zf_user/jobs/relay/view?isMypage=no&rec_idx=44459587
화장품  제품 및 웹디자이너 직원 모십니다.,에이치컴바인드(주),신입·경력학력무관정규직,서울강남구,"일러스트, 웹디자인, 상세페이지, 전자상거래 등록일 22/11/18",https://www.saramin.co.kr/zf_user/jobs/relay/view?isMypage=no&rec_idx=44464422
"자동차 부품사 영업 경력자 초빙건 (과장-차장급/국내,해외별도)",(주)커리어멘토,경력7년↑대졸↑정규직,경기시흥시,"영업, 기술영업, 자동차부품 등록일 22/11/17",https://www.saramin.co.kr/zf_user/jobs/relay/view?isMypage=no&rec_idx=44457804
