Link,title,Location,Salary,Summary
https://kr.indeed.com/viewjob?jk=726b7806205d752a,Allbirds korea 단기 계약직 (Short term Contract worker),서울 송파구,,진행중인 채용공고 2건 기업명 Allbirds Korea 홈페이지 http... shopma.net/job/shop10_read.asp?id=1468433&class_id=01 직원수 9명 인사담당자 인사담당자 부서명...
https://kr.indeed.com/viewjob?jk=3b713f7fbafa8d82,People & Culture Generalist - IKEA Giheung (6 months contrac...,경기도 고양,,"business through people. You know how to implement long- term plans, according to set budgets and goals. You have knowledge..."
https://kr.indeed.com/viewjob?jk=d079a7f5fdab7794,"MANAGER, GLOBAL KEY ACCOUNTS, WHOLESALE",서울 서초구,,Fully lead a customer`s annual sales plan and set a mid- term plan to grow both companies business... right strategy...
https://kr.indeed.com/viewjob?jk=97a9a9c792911c95,Local PVMI specialist,서울,,come. We now seek a Local PVMI Specialist (Temporary Fix Term) for our South Korean affiliate. Purpose... position...
https://kr.indeed.com/viewjob?jk=981e6a933c68fcf3,"Consultant and Senior Consultant, Power Systems – Korea",서울,,"which includes working within the team to establish long- term customer relationships, keeping abreast of industry needs..."
https://kr.indeed.com/viewjob?jk=fb8f5764cdbe3c39,"Customer Solutions Engineer, Global Client and Agency Soluti...",서울,,customers attain... business goals while building long- term capabilities... Global Client and Agency Solutions (GCAS...
https://kr.indeed.com/viewjob?jk=44f4f9ebdf9a0273,Head of OFF Premise (Seoul) with Distribution Partner,서울,,"Premise vision, long term plan, annual... Partnerships that generate long term value for Red Bull, Customers and Consumers..."
https://kr.indeed.com/viewjob?jk=bc48ed32801a196a,Admissions Counselor,인천,,upon satisfactory completion... initial contract term. Minimum Qualifications Bachelor’s degree or equivalency. One...
https://kr.indeed.com/viewjob?jk=885cfd9765788def,Senior Sales Associate (신세계 광주),광주광역시,,mindset is core to our business and key to our long- term success. JOB PURPOSE To provide an inspirational shopping...
https://kr.indeed.com/viewjob?jk=c9cfdf7579702906,"Partnerships Officer, WFP Global Liaison Office Korea",서울,,Korean nationals only. You... appointed on a National fixed- term (1 year renewable) contract. Remuneration... line...
https://kr.indeed.com/viewjob?jk=243a28468056bbeb,[Janssen] Clinical Research Manager,서울,,"appropriate. 12. Define, execute or support of long term strategy in alignment with GCO, GD and Janssen R&D strategies..."
https://kr.indeed.com/viewjob?jk=89d4b7abbd660d4e,Korea Payroll Specialist,서울,,so you can grow your career and expand your skills... long term. Cytiva is proud to work alongside a community of nine...
https://kr.indeed.com/viewjob?jk=a8f8cfe2bf32ea52,Client Program Director (HYUNDAI),서울,,account and Maersk growth – 30% • Co-create the account long term vision together... key client management • Develop...
https://kr.indeed.com/viewjob?jk=2e8a023bed940918,Trainee Sales Associate 2 (신세계 본점 남성),서울,,mindset is core to our business and key to our long- term success. JOB PURPOSE 개인 및 매장 판매 목표를 초과 달성하기 위해 노력하고 소매점 주도 성장의 주요...
https://kr.indeed.com/viewjob?jk=d5e96df8aa3b6c38,Head of Development Wind Projects South-Korea,서울,,Setting the strategy for South Korea and growing the long- term pipeline Managing a professional team and staying aligned...
https://kr.indeed.com/viewjob?jk=5a7285d6cd590b0a,[한국화이자제약] Global Supply Chain - Demand & Supply Manager,서울,,all activities surrounding generation of both short- term and long- term demand forecast Orchestrate and facilitate key forums...
https://kr.indeed.com/viewjob?jk=983933b8a40c1813,Assistant Store Manager (롯데 본점 남성),서울,,mindset is core to our business and key to our long- term success. JOB PURPOSE Through your passion for your product area...
https://kr.indeed.com/viewjob?jk=aec461f105d1cb32,"Sr. Containers Specialist, Korea",서울,,day-to-day interactions that identify prospects for long- term business opportunities. You... single-threaded owner...
https://kr.indeed.com/viewjob?jk=547a37556dcdacfb,"Territory Account Manager - Seoul, Korea",서울,,sales plans in line with assigned revenue targets and long term growth at specific key accounts. Ensure annual sales plans...
https://kr.indeed.com/viewjob?jk=525586bab74f441e,Clinical Project Assistant (1-year fixed term),서울,,About AbbVie AbbVie’s mission... discover and deliver innovative medicines that solve serious health issues today...
https://kr.indeed.com/viewjob?jk=0e424d4ef3fa5726,"Area Director Sales and Distribution, South Korea & Philippi...",서울,,"sales teams (if applicable) to build long- term, value-based customer relationships... short and long- term. Establish excellent..."
https://kr.indeed.com/viewjob?jk=55d7488785cb33df,"Modality Sales Specialist, CT",서울,,"customer relationship in order to ensure the long term profitability... defined number of accounts. Develop, lead..."
