Title,Corp,Condition,Location,Tag,Link
[한국앤컴퍼니그룹] 한국네트웍스 경력 수시채용,(주)한국네트웍스,신입·경력학력무관정규직·계약직,경기성남시,"Python, Java, 웹개발, 빅데이터, Linux 외 수정일 22/11/08",https://www.saramin.co.kr/zf_user/jobs/relay/view?isMypage=no&rec_idx=44376844
[에듀테크 스타트업 오누이/설탭] 대규모 인재 채용,(주)오누이,신입·경력초대졸↑정규직·프리랜서,서울마포구,"Python, Java, C++, AWS, 웹개발 외 수정일 22/11/02",https://www.saramin.co.kr/zf_user/jobs/relay/view?isMypage=no&rec_idx=44337477
2023년 비상교육 채용연계형 인턴 모집,(주)비상교육,신입·경력대졸↑인턴직,서울구로구,"Python, Java, 웹개발, 백엔드/서버개발, 게임개발 외 수정일 22/11/18",https://www.saramin.co.kr/zf_user/jobs/relay/view?isMypage=no&rec_idx=44456569
2022년도 하반기 화신그룹 신입사원 공채,(주)화신,신입대졸↑정규직,경북영천시,"Python, S/W, SAP, 감사, 회계사 외 수정일 22/11/17",https://www.saramin.co.kr/zf_user/jobs/relay/view?isMypage=no&rec_idx=44356969
Robot Vision 엔지니어,(주)테스트웍스,경력 5~10년학력무관정규직,서울전체,"Python, C++, 빅데이터, 머신러닝, 딥러닝 외 수정일 22/11/07",https://www.saramin.co.kr/zf_user/jobs/relay/view?isMypage=no&rec_idx=44377701
[하나금융TI] 2023년 하나금융TI 채용연계형 교육생 모집,(주)하나금융티아이,경력무관초대졸↑교육생,경기광명시,"Python, Java, C++, AWS, 웹개발 외 수정일 22/11/02",https://www.saramin.co.kr/zf_user/jobs/relay/view?isMypage=no&rec_idx=44331017
IT(백엔드/프론트엔드) 개발 및 서비스기획 포지션 채용,주식회사 리만코리아,신입·경력학력무관정규직·계약직,서울강남구,"Python, Java, AWS, Linux, 백엔드/서버개발 외 수정일 22/11/10",https://www.saramin.co.kr/zf_user/jobs/relay/view?isMypage=no&rec_idx=44394066
[블라블라ENM] 각 부문 신입 및 경력 모집,(주)블라블라이엔엠,신입·경력학력무관정규직,서울강남구,"Python, Java, C++, AWS, 웹개발 외 수정일 22/11/14",https://www.saramin.co.kr/zf_user/jobs/relay/view?isMypage=no&rec_idx=44338958
2022년 하반기 각 부문별 직원 채용,로지스팟(주),신입·경력고졸↑정규직,서울서초구,"Python, Java, AWS, 백엔드/서버개발, 프론트엔드 외 수정일 22/11/17",https://www.saramin.co.kr/zf_user/jobs/relay/view?isMypage=no&rec_idx=44427528
2023 쿠도커뮤니케이션㈜ 신입사원 공개 채용,쿠도커뮤니케이션(주),신입학력무관정규직,서울서초구,"Python, Java, C++, AWS, 웹개발 외 수정일 22/11/10",https://www.saramin.co.kr/zf_user/jobs/relay/view?isMypage=no&rec_idx=44336979
지니틱스 각 부문 신입/경력직원 채용 공고,(주)지니틱스,신입·경력초대졸↑정규직,경기용인시 기흥구,"Python, C++, Linux, FAE, QA/테스터 외 수정일 22/10/28",https://www.saramin.co.kr/zf_user/jobs/relay/view?isMypage=no&rec_idx=44291698
[DBA/클라우드 엔지니어/SAP/정보보안] 신입 및 경력 모집,㈜해커스교육그룹,신입·경력학력무관정규직,서울서초구,"Python, Java, AWS, 웹개발, 빅데이터 외 수정일 22/10/27",https://www.saramin.co.kr/zf_user/jobs/relay/view?isMypage=no&rec_idx=44082088
채.용.확.정.형 비전공자 금융IT 개발자 육성 과정 모집,(주)다우기술,신입대졸↑정규직,경기용인시 수지구,"Python, Java, C++, AWS, 웹개발 외 수정일 22/11/14",https://www.saramin.co.kr/zf_user/jobs/relay/view?isMypage=no&rec_idx=44423373
2022년 하반기 각 부문 신입/경력 상시 채용,(주)코난테크놀로지,신입·경력대졸↑정규직,서울서초구,"Python, Java, C++, 웹개발, 빅데이터 외 수정일 22/11/02",https://www.saramin.co.kr/zf_user/jobs/relay/view?isMypage=no&rec_idx=43885924
옵티시스㈜ 분야별 신입/경력사원 모집,옵티시스(주),신입·경력초대졸↑정규직,경기성남시 수정구,"Python, Java, C++, 정보통신, 펌웨어 외 수정일 22/11/17",https://www.saramin.co.kr/zf_user/jobs/relay/view?isMypage=no&rec_idx=44288078
[삼성SDS자회사](주)시큐아이 경력사원 채용,(주)시큐아이,경력학력무관정규직·계약직,서울종로구,"Python, C++, Linux, 보안컨설팅, 정보보안 외 수정일 22/11/18",https://www.saramin.co.kr/zf_user/jobs/relay/view?isMypage=no&rec_idx=44364235
(주)푸드테크 하반기 IT부문 채용,(주)푸드테크,경력학력무관정규직,서울강남구,"Python, Java, C++, AWS, 웹개발 외 수정일 22/11/16",https://www.saramin.co.kr/zf_user/jobs/relay/view?isMypage=no&rec_idx=44336111
[교원그룹] 11월 신입/경력 정기 수시채용,(주)교원,신입·경력대졸↑정규직,서울중구,"Python, Java, 웹개발, 빅데이터, 백엔드/서버개발 외 수정일 22/11/18",https://www.saramin.co.kr/zf_user/jobs/relay/view?isMypage=no&rec_idx=44461020
"[DGB데이터시스템] 22년 경력직(회계/경영관리 및 네트워크/시스템, 응용SW엔지니어링) 채용공고",(주)디지비데이터시스템,경력학력무관정규직,대구동구,"Python, Java, C++, Linux, 백엔드/서버개발 외 수정일 22/11/09",https://www.saramin.co.kr/zf_user/jobs/relay/view?isMypage=no&rec_idx=44394383
[교육비 전액무료] 인공지능(AI)/소프트웨어(SW) 교육생 모집,한국표준협회,경력무관학력무관교육생,전국,"Python, Java, C++, AWS, 웹개발 외 수정일 22/09/22",https://www.saramin.co.kr/zf_user/jobs/relay/view?isMypage=no&rec_idx=44025810
포항가속기연구소 직원 채용(연구/기술직),포항공대가속기연구소,신입·경력대졸↑정규직,경북포항시,"Python, Java, C++, C#, C언어 외 수정일 22/11/10",https://www.saramin.co.kr/zf_user/jobs/relay/view?isMypage=no&rec_idx=44401227
주) 에스지에스코리아 경력사원 2022년 공개채용,(주)에스지에스코리아,신입·경력초대졸↑정규직,경기화성시,"HRD, HRM, 무역거래, 연구원, 공정엔지니어 외 수정일 22/11/15",https://www.saramin.co.kr/zf_user/jobs/relay/view?isMypage=no&rec_idx=44401089
"언리얼, 유니티 개발자",(주)스페이스엘비스,신입·경력학력무관정규직,서울전체,"Python, C++, 웹개발, 프론트엔드, AR(증강현실) 외 등록일 22/06/29",https://www.saramin.co.kr/zf_user/jobs/relay/view?isMypage=no&rec_idx=43408746
화천기공㈜ 2022년 하반기 신입/경력 사원 채용,화천기공(주),신입·경력대졸↑정규직·인턴직,전남영광군,"Python, C++, 빅데이터, Linux, 백엔드/서버개발 외 수정일 22/11/10",https://www.saramin.co.kr/zf_user/jobs/relay/view?isMypage=no&rec_idx=44253796
각 부문별 경력사원 모집,데상트코리아(주),경력초대졸↑정규직,서울송파구,"웹개발, 앱개발, 정보보안, DBA, IT컨설팅 외 수정일 22/11/01",https://www.saramin.co.kr/zf_user/jobs/relay/view?isMypage=no&rec_idx=44323775
2022년 경력 및 신입사원 채용공고,(주)와이티에스,신입·경력학력무관정규직,경기화성시,"빅데이터, 딥러닝, 데이터분석가, 데이터엔지니어, 데이터라벨링 외 수정일 22/11/18",https://www.saramin.co.kr/zf_user/jobs/relay/view?isMypage=no&rec_idx=44463051
[지니너스] 신입 / 경력사원 수시채용,지니너스(주),경력무관대졸↑정규직,서울송파구,"Python, Java, 웹개발, Linux, IR/공시 외 수정일 22/11/17",https://www.saramin.co.kr/zf_user/jobs/relay/view?isMypage=no&rec_idx=44383960
2022년 11월 NE능률 신입 및 경력(수시) 채용,(주)NE능률,신입·경력대졸↑정규직·계약직,서울마포구,"Python, Java, Linux, 백엔드/서버개발, 보안컨설팅 외 수정일 22/11/02",https://www.saramin.co.kr/zf_user/jobs/relay/view?isMypage=no&rec_idx=44347260
(주)이엠텍 각 부문 인재채용,(주)이엠텍,신입·경력대졸↑정규직,경기안양시 동안구,"기술영업, 영업관리, 영업지원, 영업직, 영업마케팅 외 등록일 22/10/25",https://www.saramin.co.kr/zf_user/jobs/relay/view?isMypage=no&rec_idx=44279487
㈜마이크로인피니티 정규직 사원 모집,(주)마이크로인피니티,경력무관고졸↑정규직,경기수원시,"Python, Java, C++, Linux, 임베디드 외 수정일 22/11/10",https://www.saramin.co.kr/zf_user/jobs/relay/view?isMypage=no&rec_idx=44404816
인지소프트 공채 16기 하반기 신입 채용,(주)인지소프트,신입·경력초대졸↑정규직·인턴직,서울강남구,"Python, Java, C++, 웹개발, 머신러닝 외 수정일 22/11/11",https://www.saramin.co.kr/zf_user/jobs/relay/view?isMypage=no&rec_idx=44366084
2023년 대졸신입사원 공개채용,(주)네오랩컨버전스,신입대졸↑정규직,서울구로구,"Python, Java, C++, Linux, 백엔드/서버개발 외 수정일 22/10/31",https://www.saramin.co.kr/zf_user/jobs/relay/view?isMypage=no&rec_idx=44176598
[뉴링크] 프론트엔드 개발자 (신입),(주)뉴링크,신입·경력학력무관정규직,서울전체,"Python, Java, C++, 웹개발, 프론트엔드 외 수정일 22/10/07",https://www.saramin.co.kr/zf_user/jobs/relay/view?isMypage=no&rec_idx=41780003
"경영지원 대규모 채용 (HR, Legal, Finance, CES, CLS 등)",쿠팡(주),경력대졸↑정규직·계약직,서울송파구,"Python, C++, 빅데이터, 데이터분석가, 데이터엔지니어 외 수정일 22/11/15",https://www.saramin.co.kr/zf_user/jobs/relay/view?isMypage=no&rec_idx=44414992
부산 스타트업 2022년 하반기 프론트개발(신입/경력) 채용,(주)히어로웍스,경력무관학력무관정규직,부산해운대구,"백엔드/서버개발, 프론트엔드, CSS3, jQuery, 시스템관리 외 등록일 22/11/01",https://www.saramin.co.kr/zf_user/jobs/relay/view?isMypage=no&rec_idx=44332834
"연구소 개발 신입/경력채용(SDN,백엔드,서비스UI/UX,임베디드)",(주)에스비정보기술,신입·경력초대졸↑정규직,경기의왕시,"Python, Java, AWS, Linux, 백엔드/서버개발 외 수정일 22/09/30",https://www.saramin.co.kr/zf_user/jobs/relay/view?isMypage=no&rec_idx=44111726
바이오 3D프린팅 AI 머신비전시스템 제어 및 SW개발,(주)시지바이오,경력3년↑대졸↑정규직,경기성남시 중원구,"Python, 머신러닝, 딥러닝, AI(인공지능), 연구원 외 등록일 22/11/08",https://www.saramin.co.kr/zf_user/jobs/relay/view?isMypage=no&rec_idx=44388648
[인프라기술] Public Cloud 서비스 인프라 운영 담당,(주)스마일게이트스토브,경력학력무관정규직,경기성남시 분당구,"Python, AWS, Linux, 스크립트, 클라우드 외 수정일 22/10/31",https://www.saramin.co.kr/zf_user/jobs/relay/view?isMypage=no&rec_idx=44321233
빅데이터 Java/Spring Backend 개발자 채용(취업축하금 지급),(주)이팝콘,"경력무관대졸↑정규직3,000 (면접 후 협의)",서울서초구,"Python, Java, Linux, 백엔드/서버개발, SE(시스템엔지니어) 외 등록일 22/11/15",https://www.saramin.co.kr/zf_user/jobs/relay/view?isMypage=no&rec_idx=44433435
[하나금융그룹 자회사] 경력직 수시 채용,(주)핀크,경력학력무관정규직·계약직,서울중구,"Python, Java, AWS, 웹개발, 백엔드/서버개발 외 수정일 22/11/15",https://www.saramin.co.kr/zf_user/jobs/relay/view?isMypage=no&rec_idx=44433055
[외국계기업] 2022년도 하반기 부문별 경력사원 공개채용,(주)에스지에스코리아,신입·경력학력무관정규직,경기화성시,"Python, C++, Linux, 백엔드/서버개발, 앱개발 외 수정일 22/11/16",https://www.saramin.co.kr/zf_user/jobs/relay/view?isMypage=no&rec_idx=44426244
㈜켐트로닉스 전자사업본부 개발부문/사업전략실 상시채용,(주)켐트로닉스,경력 1~20년초대졸↑정규직,경기수원시 영통구,"Python, C++, 빅데이터, Linux, 머신러닝 외 수정일 22/11/14",https://www.saramin.co.kr/zf_user/jobs/relay/view?isMypage=no&rec_idx=44417413
[솔탑] 2022년 각 부문 신입 / 경력 모집,(주)솔탑,경력무관초대졸↑정규직,대전유성구,"Python, Java, C++, 웹개발, Linux 외 수정일 22/11/15",https://www.saramin.co.kr/zf_user/jobs/relay/view?isMypage=no&rec_idx=44370920
웹 / 플랫폼 개발자(Frontend),(주)테스트웍스,경력 5~10년학력무관정규직,서울전체,"Python, C++, 웹개발, 빅데이터, 머신러닝 외 수정일 22/11/07",https://www.saramin.co.kr/zf_user/jobs/relay/view?isMypage=no&rec_idx=44377641
Cloud Engineer,(주)여기어때컴퍼니,경력 3~15년학력무관정규직,서울강남구,"Python, AWS, 클라우드, DevOps, CentOS 외 수정일 22/11/08",https://www.saramin.co.kr/zf_user/jobs/relay/view?isMypage=no&rec_idx=44384917
[리디] 시니어 머신러닝 엔지니어,리디(주),경력 6~10년초대졸↑정규직,서울전체,"Python, AWS, 웹개발, 빅데이터, 백엔드/서버개발 외 등록일 22/11/16",https://www.saramin.co.kr/zf_user/jobs/relay/view?isMypage=no&rec_idx=44442221
시니어 백엔드 개발자,(주)왓섭,경력3년↑학력무관정규직,서울종로구,"Python, AWS, 백엔드/서버개발, 아키텍쳐, NoSQL 외 수정일 22/11/07",https://www.saramin.co.kr/zf_user/jobs/relay/view?isMypage=no&rec_idx=44372620
[하나금융TI] 증권 개발 부문 경력사원 모집,(주)하나금융티아이,경력무관초대졸↑정규직·계약직,인천전체,"Python, Java, C++, AWS, 웹개발 외 수정일 22/11/04",https://www.saramin.co.kr/zf_user/jobs/relay/view?isMypage=no&rec_idx=44364976
[효성계열사] 신화인터텍(주) 각 부문 신입/경력 채용,신화인터텍(주),신입·경력학력무관정규직,충남천안시,"Python, Java, AR(증강현실), ERP, VR(가상현실) 외 수정일 22/11/18",https://www.saramin.co.kr/zf_user/jobs/relay/view?isMypage=no&rec_idx=44456238
2022년 신입 및 경력 채용,(주)디알텍,신입·경력고졸↑정규직·계약직,경기성남시 분당구,"Python, C++, Linux, 머신러닝, 딥러닝 외 수정일 22/11/16",https://www.saramin.co.kr/zf_user/jobs/relay/view?isMypage=no&rec_idx=44345910
솔루션 개발 신입 및 경력 채용,(주)에이아이더뉴트리진 서울사무소,신입·경력대졸↑정규직,서울강남구,"Python, RDBMS, Flask, NoSQL, PL/SQL 외 수정일 22/11/16",https://www.saramin.co.kr/zf_user/jobs/relay/view?isMypage=no&rec_idx=44169669
AI Scientist – Source Separation,가우디오랩(주),경력무관학력무관,서울강남구,"Python, 딥러닝, AI(인공지능), Pytorch, Tensorflow 외 수정일 22/11/08",https://www.saramin.co.kr/zf_user/jobs/relay/view?isMypage=no&rec_idx=44383481
"AI영상처리 Deep tech 스타트업, 딥러닝/코덱 개발자 채용",블루닷(주),경력무관대졸↑정규직,서울강남구,"Python, C++, 머신러닝, 딥러닝, 알고리즘 외 수정일 22/11/15",https://www.saramin.co.kr/zf_user/jobs/relay/view?isMypage=no&rec_idx=44194314
[티아이기술]  임베디드/펌웨어 경력 개발자 모집,티아이기술(주),"경력3년↑학력무관정규직·계약직4,000 만원",서울구로구,"Python, Java, C++, SE(시스템엔지니어), SI개발 외 수정일 22/10/05",https://www.saramin.co.kr/zf_user/jobs/relay/view?isMypage=no&rec_idx=44109891
서현회계법인 IT 감사 및  데이터 분석가 모집,서현회계법인,경력무관대졸↑정규직,서울강남구,"Python, 정보보안, Tensorflow, 공인회계사, AICPA 외 수정일 22/11/03",https://www.saramin.co.kr/zf_user/jobs/relay/view?isMypage=no&rec_idx=44342724
[리디] 시니어 컴퓨터 비전 엔지니어,리디(주),경력 6~10년학력무관정규직,서울전체,"Python, C++, AWS, 웹개발, 빅데이터 외 등록일 22/11/16",https://www.saramin.co.kr/zf_user/jobs/relay/view?isMypage=no&rec_idx=44441825
[페스카로] 차량 사이버 보안 위협 식별 및 대응 (신입/경력),(주)페스카로,신입·경력대졸↑정규직,경기수원시 영통구,"Python, 보안컨설팅, 정보보안, 모의해킹, 악성코드 외 등록일 22/11/08",https://www.saramin.co.kr/zf_user/jobs/relay/view?isMypage=no&rec_idx=44385291
2022년 오픈나루 엔지니어 신입사원 채용,오픈나루(주),신입·경력대졸↑정규직,서울성동구,"Python, Java, 웹개발, Linux, 백엔드/서버개발 외 수정일 22/10/06",https://www.saramin.co.kr/zf_user/jobs/relay/view?isMypage=no&rec_idx=44148096
[자동차][BMW] 완성차 텔레매틱스(차량통신) 개발 QA,(주)티스퀘어랩,경력무관초대졸↑정규직,서울중구,"Python, QA/테스터, MySQL, R&D, 전자파 외 수정일 22/11/04",https://www.saramin.co.kr/zf_user/jobs/relay/view?isMypage=no&rec_idx=44112274
[잇츠미] 프로그래머,클로버게임즈(주),경력무관학력무관,서울서초구,"Python, C++, AWS, Android, C# 외 수정일 22/11/08",https://www.saramin.co.kr/zf_user/jobs/relay/view?isMypage=no&rec_idx=44384643
[스마트빌싸인] JAVA개발자,(주)비즈니스온커뮤니케이션,경력 2~7년초대졸↑정규직,서울전체,"Python, Java, 웹개발, 백엔드/서버개발, 퍼블리셔 외 수정일 22/04/26",https://www.saramin.co.kr/zf_user/jobs/relay/view?isMypage=no&rec_idx=41590685
알고리즘/코딩테스트 제작자,(주)엘리스,경력무관학력무관,서울강남구,"Python, 유지보수, 알고리즘, Javascript, Node.js 외 수정일 22/10/28",https://www.saramin.co.kr/zf_user/jobs/relay/view?isMypage=no&rec_idx=44310541
AI Scientist – Audio Synthesis,가우디오랩(주),경력무관학력무관,서울강남구,"Python, 딥러닝, AI(인공지능), Pytorch, Tensorflow 외 수정일 22/11/08",https://www.saramin.co.kr/zf_user/jobs/relay/view?isMypage=no&rec_idx=44383544
(판교/월270만)만도연구소 전기전자/SW 연구보조 채용,(주)휴먼앤,경력무관초대졸↑계약직·파견직270 만원,경기성남시 분당구,"Python, Java, C++, S/W, C언어 외 등록일 22/11/09",https://www.saramin.co.kr/zf_user/jobs/relay/view?isMypage=no&rec_idx=44394243
브이텐시스템 S/W 개발자 채용(경력직),(주)브이텐시스템,경력학력무관정규직,경기오산시,"Python, C++, 딥러닝, C#, MFC 외 등록일 22/11/15",https://www.saramin.co.kr/zf_user/jobs/relay/view?isMypage=no&rec_idx=44438828
R&D 사업 기획 및 수행 경력 채용,(재)한국조명아이씨티연구원,경력1년↑대졸↑정규직,경기부천시,"연구원, R&D, R&D기획, 기술연구, 전자파 외 수정일 22/11/09",https://www.saramin.co.kr/zf_user/jobs/relay/view?isMypage=no&rec_idx=44396523
데이터 사이언티스트,(주)비포플레이,경력 5~8년학력무관정규직,서울전체,"Python, AWS, 웹개발, 빅데이터, 백엔드/서버개발 외 등록일 21/12/08",https://www.saramin.co.kr/zf_user/jobs/relay/view?isMypage=no&rec_idx=41799488
[자율주행/서울] Software Engineer,(주)아데코코리아,경력5년↑대졸↑정규직,서울성동구,"Python, C++, 기술지원, 프론트엔드, 알고리즘 외 등록일 22/11/18",https://www.saramin.co.kr/zf_user/jobs/relay/view?isMypage=no&rec_idx=44458721
Web Service / Back-End 엔지니어,(주)마크로젠,경력 6~8년초대졸↑정규직,서울전체,"Python, Java, AWS, 웹개발, 백엔드/서버개발 외 수정일 22/10/31",https://www.saramin.co.kr/zf_user/jobs/relay/view?isMypage=no&rec_idx=43928853
[고영테크놀러지] 신입(인턴) / 경력 사원 모집,(주)고영테크놀러지,신입·경력대졸↑정규직·인턴직,경기용인시 수지구,"Python, Java, C++, 웹개발, Linux 외 수정일 22/11/16",https://www.saramin.co.kr/zf_user/jobs/relay/view?isMypage=no&rec_idx=44424302
22년 LS ITC 채용연계형 인턴 모집,엘에스아이티씨(주),신입대졸↑정규직·인턴직,서울용산구,"Python, AWS, 기술지원, 보안컨설팅, 유지보수 외 수정일 22/11/08",https://www.saramin.co.kr/zf_user/jobs/relay/view?isMypage=no&rec_idx=44362441
신입/경력 개발자 채용(Front-end/Android · IOS/Back-end),아이넷캅,신입·경력대졸↑정규직·전문연구요원,서울송파구,"Python, Android, CSS3, Django, Flask 외 수정일 22/11/17",https://www.saramin.co.kr/zf_user/jobs/relay/view?isMypage=no&rec_idx=44373775
AI 및 데이터 분석 전문가,(주)씨티아이랩,경력1년↑대졸↑정규직,서울서초구,"Python, AWS, 빅데이터, 머신러닝, 딥러닝 외 수정일 22/11/10",https://www.saramin.co.kr/zf_user/jobs/relay/view?isMypage=no&rec_idx=44401877
Kubernetes에 미친 사람을 찾습니다.,오픈나루(주),경력대졸↑정규직,서울성동구,"Python, Java, 웹개발, Linux, 백엔드/서버개발 외 수정일 22/10/06",https://www.saramin.co.kr/zf_user/jobs/relay/view?isMypage=no&rec_idx=44148007
[플랫폼개발] 백엔드 개발 리더 (팀장),(주)크로커스,경력 7~20년학력무관정규직,서울전체,"Python, 웹개발, 빅데이터, Linux, 백엔드/서버개발 외 등록일 22/09/23",https://www.saramin.co.kr/zf_user/jobs/relay/view?isMypage=no&rec_idx=44055027
윈도우 응용프로그램 개발자 신입사원 채용 #강소기업 #워라밸,(주)데이터로드,신입초대졸↑정규직,서울영등포구,"Python, Java, AWS, 백엔드/서버개발, 프론트엔드 외 수정일 22/11/08",https://www.saramin.co.kr/zf_user/jobs/relay/view?isMypage=no&rec_idx=44389957
공공기관 웹 시스템 운영을 위한 상주(세종시) 인력 모집,(주)지오아이티,신입·경력초대졸↑정규직,세종특별자치시,"Python, Java, 웹개발, Ajax, HTML 외 등록일 22/11/14",https://www.saramin.co.kr/zf_user/jobs/relay/view?isMypage=no&rec_idx=44421800
유럽법인 Python 개발자,(주)솔로몬텍,경력2년↑초대졸↑정규직·계약직,유럽독일,"Python, 웹개발, SI개발, S/W, Apache 외 수정일 22/09/28",https://www.saramin.co.kr/zf_user/jobs/relay/view?isMypage=no&rec_idx=44092035
Python 백엔드 개발자,(주)펫박스,경력 3~7년학력무관정규직,서울전체,"Python, AWS, 웹개발, 백엔드/서버개발, 프론트엔드 외 수정일 21/12/20",https://www.saramin.co.kr/zf_user/jobs/relay/view?isMypage=no&rec_idx=41895007
[전문연구요원 가능] 강화학습 제어 기술 연구원,(주)메디인테크,경력무관대졸↑정규직,서울종로구,"Python, C++, 머신러닝, AI(인공지능), Tensorflow 외 등록일 22/10/17",https://www.saramin.co.kr/zf_user/jobs/relay/view?isMypage=no&rec_idx=44221401
데이터 사이언티스트 (총괄급),(주)카비,경력 7~10년박사정규직,서울전체,"Python, 빅데이터, 머신러닝, 딥러닝, 데이터분석가 외 수정일 22/06/24",https://www.saramin.co.kr/zf_user/jobs/relay/view?isMypage=no&rec_idx=42703701
[패스오더] DevOps Engineer (병역특례/산업기능요원/보충역/전직),(주)페이타랩,신입·경력학력무관정규직,서울전체,"Python, Java, AWS, 웹개발, 백엔드/서버개발 외 수정일 22/09/29",https://www.saramin.co.kr/zf_user/jobs/relay/view?isMypage=no&rec_idx=42360508
(주)코인플러그 Defi팀 직원 모집,(주)코인플러그,경력무관학력무관정규직,경기성남시 수정구,"Python, AWS, Linux, 블록체인, 사업기획 외 등록일 22/11/01",https://www.saramin.co.kr/zf_user/jobs/relay/view?isMypage=no&rec_idx=44339360
데이터실 - ElasticSearch 검색엔진 엔지니어 (5년이상 or Data Scientist),(주)발란,경력 5~15년대졸↑정규직,서울전체,"Python, AWS, 웹개발, 빅데이터, Linux 외 수정일 22/11/08",https://www.saramin.co.kr/zf_user/jobs/relay/view?isMypage=no&rec_idx=43918678
데이터 개발자,쿤텍(주),신입·경력대졸↑정규직,경기전체,"Python, AWS, 웹개발, 빅데이터, 백엔드/서버개발 외 수정일 22/08/05",https://www.saramin.co.kr/zf_user/jobs/relay/view?isMypage=no&rec_idx=43409232
"소프트웨어 개발자 모집(Java, Android, C#.NET, PHP, C++)",주식회사 미노시스,신입학력무관정규직·해외취업,일본도쿄,"Python, Java, C++, 웹개발, .NET 외 수정일 22/10/24",https://www.saramin.co.kr/zf_user/jobs/relay/view?isMypage=no&rec_idx=44278589
(주)리파인 각 부문별 신입/경력 채용공고,(주)리파인,신입·경력초대졸↑정규직·계약직,서울강남구,"Python, Java, AWS, 웹개발, 빅데이터 외 수정일 22/11/03",https://www.saramin.co.kr/zf_user/jobs/relay/view?isMypage=no&rec_idx=44345196
[글로벌유니콘] Technical Account Manager /Senior SW/Frontend,HR컨설팅(주),경력3년↑대졸↑정규직,서울강남구,"Python, Java, C++, AWS, 웹개발 외 등록일 22/11/10",https://www.saramin.co.kr/zf_user/jobs/relay/view?isMypage=no&rec_idx=44403359
"2배씩 성장, 업계 최대 대우(PD·작가·AE·경영지원·매니저·개발)",(주)트루빈스,"경력무관학력무관정규직3,750 만원",서울강남구,"Python, Java, AWS, 웹개발, 빅데이터 외 수정일 22/11/17",https://www.saramin.co.kr/zf_user/jobs/relay/view?isMypage=no&rec_idx=44335548
Data Platform Tech Lead,(주)드라마앤컴퍼니,경력7년↑학력무관정규직,서울강남구,"Python, Java, 데이터분석가, 인프라, Hadoop 외 수정일 22/11/03",https://www.saramin.co.kr/zf_user/jobs/relay/view?isMypage=no&rec_idx=44352935
빅데이터센터 데이터팀 Data Engineer,(주)드라마앤컴퍼니,경력3년↑학력무관정규직,서울강남구,"Python, Java, 빅데이터, 데이터엔지니어, RDBMS 외 수정일 22/11/03",https://www.saramin.co.kr/zf_user/jobs/relay/view?isMypage=no&rec_idx=44353016
[재택근무] 백엔드/서버개발자 신입사원 모집,(주)한국컨텐츠인프라,신입학력무관정규직,서울서초구,"Python, Java, C++, 웹개발, 백엔드/서버개발 외 수정일 22/11/16",https://www.saramin.co.kr/zf_user/jobs/relay/view?isMypage=no&rec_idx=44438339
