Title,Corp,Condition,Location,Tag,Link
PC Application UX/UI 항공우주부품 시험 플랫폼 개발 및 유지관리,루미르(주),신입·경력대졸↑정규직,경기전체,"Python, Java, C++, 웹개발, 앱개발 외 수정일 21/09/03",https://www.saramin.co.kr/zf_user/jobs/relay/view?isMypage=no&rec_idx=41082358
타이아 주식회사 테크놀로지센터 (광주) 각 부문 채용 공고,타이아(주),"경력무관대졸↑정규직3,100 만원",광주광산구,"Python, Java, C++, 웹개발, 빅데이터 외 수정일 22/11/07",https://www.saramin.co.kr/zf_user/jobs/relay/view?isMypage=no&rec_idx=44378906
[매스아시아][알파카] 데이터 엔지니어 채용,(주)매스아시아,경력무관학력무관정규직,서울서초구,"Python, 빅데이터, 데이터분석가, 데이터엔지니어, 데이터마이닝 외 등록일 22/09/28",https://www.saramin.co.kr/zf_user/jobs/relay/view?isMypage=no&rec_idx=44089945
(주)이녹스첨단소재 경영정보(전산)담당 신입/경력직 채용,(주)이녹스첨단소재,신입·경력대졸↑정규직,충남아산시,"Python, Java, 웹개발, 기술지원, 유지보수 외 등록일 22/11/17",https://www.saramin.co.kr/zf_user/jobs/relay/view?isMypage=no&rec_idx=44452012
[스타랩스] 웹개발자 초/중/고/특급 채용,주식회사 스타랩스,경력무관초대졸↑정규직·프리랜서,서울강남구,"Python, Java, AWS, 웹개발, Linux 외 수정일 22/11/07",https://www.saramin.co.kr/zf_user/jobs/relay/view?isMypage=no&rec_idx=44262285
JAVA / DBA / SE / 런처 개발 / 각 기획 직무,(주)코리아폴리스쿨,경력학력무관정규직,서울송파구,"Python, Java, AWS, 웹개발, Linux 외 수정일 22/11/04",https://www.saramin.co.kr/zf_user/jobs/relay/view?isMypage=no&rec_idx=44360410
대전선병원 보안담당자 및 신규프로그램 개발 및 서버 운영 인력,(의)영훈의료재단,신입·경력대졸↑정규직,대전중구,"Python, AWS, 앱개발, 유지보수, 정보보안 외 등록일 22/11/10",https://www.saramin.co.kr/zf_user/jobs/relay/view?isMypage=no&rec_idx=44403582
AI(Computer Vision) Researcher,한국축산데이터(주),경력 2~10년석사↑정규직,서울전체,"Python, C++, 빅데이터, 머신러닝, 딥러닝 외 수정일 22/10/17",https://www.saramin.co.kr/zf_user/jobs/relay/view?isMypage=no&rec_idx=43873070
DevOps/Infrastructure Engineer,언노티드(유),경력무관대졸↑정규직,서울강남구,"Python, Java, C++, AWS, Linux 외 등록일 22/10/17",https://www.saramin.co.kr/zf_user/jobs/relay/view?isMypage=no&rec_idx=44222365
㈜이엠넷 디지털마케팅AE/개발자 경력직 채용 [서울본사],(주)이엠넷,경력대졸↑정규직,서울구로구,"Python, Java, C++, 웹개발, 백엔드/서버개발 외 수정일 22/11/14",https://www.saramin.co.kr/zf_user/jobs/relay/view?isMypage=no&rec_idx=44403833
AI 제품개발,(주)네오리진,신입·경력학력무관정규직,서울전체,"Python, Java, 웹개발, 빅데이터, 머신러닝 외 수정일 22/10/06",https://www.saramin.co.kr/zf_user/jobs/relay/view?isMypage=no&rec_idx=44148055
"[수원, 기흥, 화성] 노리시스템 신입 / 경력 개발자 모집",노리시스템(주),신입·경력초대졸↑정규직,경기용인시 기흥구,"Python, Java, C++, 웹개발, Linux 외 수정일 22/11/02",https://www.saramin.co.kr/zf_user/jobs/relay/view?isMypage=no&rec_idx=44303691
[마크로젠] 전문연구요원 채용 (Bioinformatics),(주)마크로젠,신입·경력석사↑정규직·전문연구요원,서울금천구,"Python, Java, AWS, Linux, 알고리즘 외 수정일 22/11/18",https://www.saramin.co.kr/zf_user/jobs/relay/view?isMypage=no&rec_idx=44357585
플랫폼 이미지 전략 담당자,주식회사 위대한상상,경력3년↑학력무관정규직,서울서초구,"콘텐츠관리, 콘텐츠기획, Excel, PhotoShop, 전자상거래 외 등록일 22/11/16",https://www.saramin.co.kr/zf_user/jobs/relay/view?isMypage=no&rec_idx=44445788
GIS 개발자,(주)랜드정보기술,경력무관학력무관정규직,대전유성구,"Java, S/W, 솔루션, GIS, 지도제작업 수정일 22/10/21",https://www.saramin.co.kr/zf_user/jobs/relay/view?isMypage=no&rec_idx=44261809
[더블다운인터액티브] 2022 대규모 채용,(주)더블다운인터액티브,경력무관학력무관정규직,서울강남구,"Python, Java, C++, AWS, 웹개발 외 수정일 22/11/08",https://www.saramin.co.kr/zf_user/jobs/relay/view?isMypage=no&rec_idx=44199275
(주)태성에스엔이 CFD 유동 엔지니어 채용 건,(주)태성에스엔이,석사↑정규직,,"R&D, 기계, 기계설계 수정일 22/10/18",https://www.saramin.co.kr/zf_user/jobs/relay/view?isMypage=no&rec_idx=44222402
[ESTsoft] Android 개발자 (경력),이스트소프트,경력 2~7년학력무관정규직,서울서초구,"Python, Java, AWS, 웹개발, 머신러닝 외 수정일 22/11/07",https://www.saramin.co.kr/zf_user/jobs/relay/view?isMypage=no&rec_idx=44374825
[스타일셀러] 백앤드 개발자 모집,(주)스타일셀러,경력무관학력무관정규직,서울서초구,"Python, Java, C++, 웹개발, 빅데이터 외 수정일 22/11/16",https://www.saramin.co.kr/zf_user/jobs/relay/view?isMypage=no&rec_idx=44244669
서비스 엔지니어(생체신호),(주)뷰노,신입대졸↑정규직,서울서초구,"Python, AWS, 웹개발, 앱개발, 유지보수 외 수정일 22/10/31",https://www.saramin.co.kr/zf_user/jobs/relay/view?isMypage=no&rec_idx=44323349
Mobility Search Engineer,티맵모빌리티(주),경력3년↑학력무관정규직,서울전체,"Python, Java, Linux, 앱개발, SE(시스템엔지니어) 외 등록일 22/08/18",https://www.saramin.co.kr/zf_user/jobs/relay/view?isMypage=no&rec_idx=43787482
데이터 헌터,(주)이젤,신입·경력대졸↑정규직,서울중구,"Python, Java, AWS, Git, HTML 외 등록일 22/10/24",https://www.saramin.co.kr/zf_user/jobs/relay/view?isMypage=no&rec_idx=44278672
Senior Digital Design Engineer 모집,(주)다이얼로그세미컨덕터오퍼레이션즈서비스리미티드,경력5년↑대졸↑정규직,경기성남시 분당구,"Python, R, R&D, FPGA, Verilog 외 수정일 22/10/24",https://www.saramin.co.kr/zf_user/jobs/relay/view?isMypage=no&rec_idx=44276807
아스트론시큐리티 경력직 모집 (클라우드 보안 솔루션),(주)아스트론시큐리티,경력1년↑학력무관정규직,서울강남구,"Python, Java, AWS, 보안컨설팅, SE(시스템엔지니어) 외 등록일 22/11/10",https://www.saramin.co.kr/zf_user/jobs/relay/view?isMypage=no&rec_idx=44404517
신사업개발팀 개발자,(주)메이크스타,신입·경력학력무관정규직,서울전체,"Python, Java, 웹개발, 앱개발, 프론트엔드 외 수정일 22/07/29",https://www.saramin.co.kr/zf_user/jobs/relay/view?isMypage=no&rec_idx=43125000
프론트엔드 개발자 모집,식스티헤르츠(주),경력무관학력무관정규직,서울중구,"Python, AWS, 웹개발, 프론트엔드, CSS 외 등록일 22/11/01",https://www.saramin.co.kr/zf_user/jobs/relay/view?isMypage=no&rec_idx=44329794
"AI, 빅데이터, 머신러닝 연구원 모집",(주)씽크풀,경력무관대졸↑정규직,서울영등포구,"Python, C++, 빅데이터, 머신러닝, 데이터분석가 외 수정일 22/09/21",https://www.saramin.co.kr/zf_user/jobs/relay/view?isMypage=no&rec_idx=44039831
[신입] 자율주행 시스템 개발자,(주)에이스랩,신입·경력대졸↑정규직,서울전체,"Python, C++, Linux, SE(시스템엔지니어), 인프라 외 수정일 22/11/01",https://www.saramin.co.kr/zf_user/jobs/relay/view?isMypage=no&rec_idx=43896389
"[본사] 한국평가데이터(KoDATA) 데이터가공/ 추출 (SQL, DBMS)",에이스휴먼파워(주),경력무관대졸↑계약직333 만원,서울영등포구,"Python, Java, C++, 웹개발, 빅데이터 외 등록일 22/11/04",https://www.saramin.co.kr/zf_user/jobs/relay/view?isMypage=no&rec_idx=44360080
응용기술 (Display Driver IC) - 파운드리 대기업,(주)프로매치코리아,경력3년↑대졸↑정규직,경기부천시,"반도체설계, CVD, LCD, 디스플레이, 반도체 외 등록일 22/11/16",https://www.saramin.co.kr/zf_user/jobs/relay/view?isMypage=no&rec_idx=44440808
웹 스크래핑 개발자 영입,(주)카카오페이,경력3년↑학력무관정규직,경기성남시 분당구,"Python, 웹개발, 백엔드/서버개발, Android, CSS 외 수정일 22/11/04",https://www.saramin.co.kr/zf_user/jobs/relay/view?isMypage=no&rec_idx=44359169
서울대학교병원 데이터분석/머신러닝 연구원 및 대학원생 채용,서울대학교병원,경력무관대졸↑계약직,서울종로구,"Python, AWS, 빅데이터, 머신러닝, 딥러닝 외 수정일 22/10/24",https://www.saramin.co.kr/zf_user/jobs/relay/view?isMypage=no&rec_idx=44199773
[부민병원소속] EMR 프론트엔드/백엔드 개발자를 모십니다.,(주)비플러스랩,신입·경력초대졸↑정규직·계약직,서울강서구,"Python, Java, C++, AWS, 웹개발 외 수정일 22/10/27",https://www.saramin.co.kr/zf_user/jobs/relay/view?isMypage=no&rec_idx=44302234
웹 기반 프로그램 개발자 (백엔드/프론트) 채용,시스트로닉스(주),경력 1~3년초대졸↑정규직,경기부천시 오정구,"Python, Java, 웹개발, 백엔드/서버개발, 앱개발 외 등록일 22/11/03",https://www.saramin.co.kr/zf_user/jobs/relay/view?isMypage=no&rec_idx=44354631
SRE 담당자(CI/CD),(주)위메프,경력2년↑학력무관정규직,서울강남구,"Python, 앱개발, DevOps, GoLang, Groovy 외 수정일 22/11/01",https://www.saramin.co.kr/zf_user/jobs/relay/view?isMypage=no&rec_idx=44333113
Release Engineer 영입,(주)카카오페이,경력무관학력무관정규직,경기성남시 분당구,"Python, Java, 웹개발, 앱개발, DevOps 외 수정일 22/11/08",https://www.saramin.co.kr/zf_user/jobs/relay/view?isMypage=no&rec_idx=44383258
2022년 하반기 부문별 인재영입(경력),(주)핏펫,신입·경력학력무관정규직·계약직,서울강남구,"Python, MySQL, R, 감사, 경리 외 수정일 22/11/18",https://www.saramin.co.kr/zf_user/jobs/relay/view?isMypage=no&rec_idx=44039792
데이터분석/모델링 전문가,티맵모빌리티(주),경력3년↑학력무관정규직,서울전체,"Python, 데이터분석가, 데이터엔지니어, 모델링, 알고리즘 외 등록일 22/08/18",https://www.saramin.co.kr/zf_user/jobs/relay/view?isMypage=no&rec_idx=43787371
[클루커스] BI 대시보드 개발·구축 모집,(주)클루커스,경력2년↑학력무관정규직,서울강남구,"Python, 클라우드, 모델링, 솔루션, SQL 외 등록일 22/11/08",https://www.saramin.co.kr/zf_user/jobs/relay/view?isMypage=no&rec_idx=44388328
"[금융정보제공] 인덱스리서치, 해외 주식 CA 관련 실무 경력자",(주)스텝씨,경력 2~8년대졸↑정규직,서울강남구,"Python, R, SQL, CFA, 투자자문 외 등록일 22/11/16",https://www.saramin.co.kr/zf_user/jobs/relay/view?isMypage=no&rec_idx=44443385
"풀스택,프론트엔드,백엔드 개발, 빅데이터 및 IT강사 채용",(주)이젠아카데미,경력5년↑학력무관정규직·계약직,서울강남구,"Java, C++, AWS, 웹개발, 빅데이터 외 수정일 22/09/29",https://www.saramin.co.kr/zf_user/jobs/relay/view?isMypage=no&rec_idx=44098341
솔루션 유지보수,(주)솔트룩스,경력 3~7년초대졸↑정규직,서울전체,"Python, Java, 웹개발, 빅데이터, 기술지원 외 등록일 22/11/09",https://www.saramin.co.kr/zf_user/jobs/relay/view?isMypage=no&rec_idx=44398015
AI 프로젝트 수행파트장,(주)솔트룩스,경력 15~20년초대졸↑정규직,서울전체,"Python, Java, 웹개발, 빅데이터, 머신러닝 외 등록일 22/11/10",https://www.saramin.co.kr/zf_user/jobs/relay/view?isMypage=no&rec_idx=44401726
GMS(Google Mobile Service) 인증지원 신입 채용,(주)포인트모바일,신입초대졸↑정규직,서울금천구,"Python, Java, C++, 웹개발, Linux 외 수정일 22/10/17",https://www.saramin.co.kr/zf_user/jobs/relay/view?isMypage=no&rec_idx=44221907
긴급) 업계 최고 대기업 - AI 개발PM - 최우대 (진행중),휴머레인컨설팅,경력10년↑학력무관정규직,서울강남구,"Python, 빅데이터, 머신러닝, 딥러닝, 앱개발 외 등록일 22/11/19",https://www.saramin.co.kr/zf_user/jobs/relay/view?isMypage=no&rec_idx=44467353
[패스오더] 급성장중인 스타트업 '데이터 엔지니어' 채용,(주)페이타랩,경력무관고졸↑정규직·계약직,부산부산진구,"Python, 웹개발, 빅데이터, 백엔드/서버개발, 데이터분석가 외 수정일 22/11/17",https://www.saramin.co.kr/zf_user/jobs/relay/view?isMypage=no&rec_idx=44378393
Integration Engineer - TelCo 5G OpenShift Integration,레드햇리미티드영업소,경력 5~25년학력무관정규직,서울전체,"Python, 웹개발, Linux, SE(시스템엔지니어), 인프라 외 수정일 22/06/30",https://www.saramin.co.kr/zf_user/jobs/relay/view?isMypage=no&rec_idx=43417612
자바스크립트 FullStack 연구자 채용,가천대학교산학협력단,경력무관대졸↑기간제·계약직,인천남동구,"Python, 웹개발, ECMAScript, Javascript, Node.js 외 등록일 22/11/08",https://www.saramin.co.kr/zf_user/jobs/relay/view?isMypage=no&rec_idx=44390261
Connected Car S/W Rapid Prototyping,(주)에어플러그,경력2년↑학력무관정규직,서울송파구,"Python, Java, C++, Linux, 임베디드 외 수정일 22/10/28",https://www.saramin.co.kr/zf_user/jobs/relay/view?isMypage=no&rec_idx=44309315
Digital Marketing (디지털 마케팅/마케터),(주)엔도아이,경력2년↑대졸↑정규직,서울서초구,"영업마케팅, 인플루언서, 병원마케팅, 마케팅기획, 마케팅전략 외 등록일 22/09/22",https://www.saramin.co.kr/zf_user/jobs/relay/view?isMypage=no&rec_idx=44047136
데이터베이스 관리자(DBA),콘텐츠웨이브(주),경력 3~20년학력무관정규직,서울전체,"Python, 웹개발, DBA, SE(시스템엔지니어), 검색엔진 외 수정일 22/11/04",https://www.saramin.co.kr/zf_user/jobs/relay/view?isMypage=no&rec_idx=42526160
[오디오플랫폼FLO] Backend(Junior) 개발자,(주)드림어스컴퍼니,경력 1~5년학력무관정규직,서울전체,"Python, Java, 웹개발, Linux, 백엔드/서버개발 외 수정일 22/09/22",https://www.saramin.co.kr/zf_user/jobs/relay/view?isMypage=no&rec_idx=40715106
긴급) 업계 최고 대기업 - 운영 PMO - 최우대,휴머레인컨설팅,경력3년↑학력무관정규직,서울강남구,"Python, 머신러닝, 앱개발, 클라우드, Android 외 등록일 22/11/19",https://www.saramin.co.kr/zf_user/jobs/relay/view?isMypage=no&rec_idx=44467319
Tanzu Platform Architect (Pre-Sales/K8s/DevOps) 채용,메가존클라우드(주),경력무관학력무관정규직,서울강남구,"Python, AWS, Linux, IT컨설팅, 인프라 외 등록일 22/11/14",https://www.saramin.co.kr/zf_user/jobs/relay/view?isMypage=no&rec_idx=44423965
소프트웨어 인증-검증 / 가상현실 로봇시뮬레이터 개발,㈜엠앤디,"경력무관대졸↑정규직·전문연구요원4,000 만원",부산기장군,"Python, S/W, VR(가상현실), C#, Unity 외 수정일 22/11/17",https://www.saramin.co.kr/zf_user/jobs/relay/view?isMypage=no&rec_idx=44457706
보안솔루션 개발자 정규직 모집,(주)디지탈센스,경력 1~10년초대졸↑정규직,서울금천구,"Python, C++, AWS, Linux, 백엔드/서버개발 외 등록일 22/11/07",https://www.saramin.co.kr/zf_user/jobs/relay/view?isMypage=no&rec_idx=44371344
(경력)웹/앱용 백앤드 API 및 배치개발자,한국금융공학컨설팅(주),경력 3~5년초대졸↑정규직,서울구로구,"Python, Java, AWS, 웹개발, 빅데이터 외 등록일 22/11/09",https://www.saramin.co.kr/zf_user/jobs/relay/view?isMypage=no&rec_idx=44396165
NLP Engineer,(주)위메프,경력3년↑석사↑정규직,서울강남구,"Python, Java, 빅데이터, NLP(자연어처리), AI(인공지능) 외 수정일 22/11/01",https://www.saramin.co.kr/zf_user/jobs/relay/view?isMypage=no&rec_idx=44332824
에브리봇(주) AI융합기술연구소 경력직 채용,에브리봇(주),경력무관학력무관정규직,경기성남시 분당구,"Python, 웹개발, 머신러닝, 딥러닝, 프론트엔드 외 등록일 22/11/16",https://www.saramin.co.kr/zf_user/jobs/relay/view?isMypage=no&rec_idx=44441226
스마트공장(MES시스템) 개발 신입사원 모집,더블유앤이케이,신입학력무관정규직,서울금천구,"Python, AI(인공지능), .NET, C#, MES 외 수정일 22/11/02",https://www.saramin.co.kr/zf_user/jobs/relay/view?isMypage=no&rec_idx=44086170
(판교)HL만도 SW연구보조 및 사무행정 채용,(주)에스텍플러스,경력무관초대졸↑계약직·파견직270 만원,경기성남시 분당구,"Python, Java, C++, C언어, 서무 외 수정일 22/11/11",https://www.saramin.co.kr/zf_user/jobs/relay/view?isMypage=no&rec_idx=44396823
Digital Workplace(consultant/사업전략 등) 채용,메가존클라우드(주),경력무관학력무관정규직,서울강남구,"Python, Java, C++, AWS, 클라우드 외 등록일 22/11/14",https://www.saramin.co.kr/zf_user/jobs/relay/view?isMypage=no&rec_idx=44423846
"슈퍼윙스, 엄마까투리 제작사 Linux 서버 개발 및 운영자 모집",(주)퍼니플럭스,경력 1~4년학력무관정규직,서울마포구,"Python, C++, Linux, 백엔드/서버개발, DBA 외 등록일 22/11/14",https://www.saramin.co.kr/zf_user/jobs/relay/view?isMypage=no&rec_idx=44424669
[알바천국] .NET 백엔드 웹개발자 경력직 모집,(주)미디어윌네트웍스,경력 3~10년초대졸↑정규직,서울강남구,"Python, Java, C++, AWS, 웹개발 외 등록일 22/11/07",https://www.saramin.co.kr/zf_user/jobs/relay/view?isMypage=no&rec_idx=44378183
성능테스트 엔지니어,(주)위메프,경력학력무관정규직,서울강남구,"Python, Java, 웹개발, Linux, 앱개발 외 수정일 22/11/01",https://www.saramin.co.kr/zf_user/jobs/relay/view?isMypage=no&rec_idx=44333334
(주)포원시스템 C# 프로그램 개발자 경력직 모집합니다.,(주)포원시스템,경력 1~10년학력무관정규직,경북경산시,"Python, C++, Windows, C#, MSSQL 외 수정일 22/11/02",https://www.saramin.co.kr/zf_user/jobs/relay/view?isMypage=no&rec_idx=44111952
소프트웨어개발자 채용,(주)사이버네틱스이미징시스템즈,경력무관대졸↑정규직,경남창원시,"Python, 머신러닝, 딥러닝, 알고리즘, 이미지프로세싱 외 수정일 22/11/17",https://www.saramin.co.kr/zf_user/jobs/relay/view?isMypage=no&rec_idx=44249108
[채용] 슈페릭스 - Quantitative Researcher,(주)슈페릭스,경력3년↑대졸↑정규직,서울강남구,"Python, 빅데이터, 백엔드/서버개발, 딥러닝, 데이터분석가 외 등록일 22/11/15",https://www.saramin.co.kr/zf_user/jobs/relay/view?isMypage=no&rec_idx=44438347
"TDI 뉴스 공개채용 (백엔드, 프론트엔드, 앱/웹기획)",(주)티디아이시티,경력1년↑학력무관정규직,서울서초구,"Python, Java, AWS, 웹개발, 빅데이터 외 수정일 22/10/24",https://www.saramin.co.kr/zf_user/jobs/relay/view?isMypage=no&rec_idx=44085077
임베디드 어플리케이션 소프트웨어 개발자 채용,(주)디퍼아이,경력무관학력무관정규직·계약직,서울강남구,"Python, C++, Linux, 딥러닝, 임베디드 외 수정일 22/10/27",https://www.saramin.co.kr/zf_user/jobs/relay/view?isMypage=no&rec_idx=44306062
초음파 진단기기 영상처리 개발(경력직),(주)배럴아이,경력 6~10년초대졸↑정규직,서울강남구,"Python, C++, Windows, 영상처리, Matlab 외 등록일 22/10/18",https://www.saramin.co.kr/zf_user/jobs/relay/view?isMypage=no&rec_idx=44232958
Machine Learning Engineer,(주)마키나락스,경력 2~10년학력무관정규직,서울전체,"Python, 빅데이터, Linux, 머신러닝, 딥러닝 외 수정일 22/07/14",https://www.saramin.co.kr/zf_user/jobs/relay/view?isMypage=no&rec_idx=42785267
영상처리 및 광학 알고리즘 개발자 정규직 채용 (신입/경력),(주)미래로시스템,신입·경력대졸↑정규직,경기용인시 기흥구,"Python, C#, Tensorflow, 모델링, 알고리즘 외 등록일 22/11/04",https://www.saramin.co.kr/zf_user/jobs/relay/view?isMypage=no&rec_idx=44364286
AI Solution팀 인재 모집,(주)디텍,대졸↑정규직,,"Python, C++, Linux, 딥러닝, 알고리즘 외 등록일 22/10/07",https://www.saramin.co.kr/zf_user/jobs/relay/view?isMypage=no&rec_idx=44159342
화상회의 시스템 S/W 개발,오픈스택 주식회사,경력무관학력무관정규직,경기성남시 분당구,"Python, Linux, S/W, Nginx, CSS 외 등록일 22/11/15",https://www.saramin.co.kr/zf_user/jobs/relay/view?isMypage=no&rec_idx=44431339
Azure SA(Solution Arcitect) 영입,베스핀글로벌(주),경력7년↑초대졸↑정규직,서울서초구,"Python, AWS, 빅데이터, Linux, 클라우드 외 등록일 22/10/26",https://www.saramin.co.kr/zf_user/jobs/relay/view?isMypage=no&rec_idx=44294994
긴급) IT분야 기술기획 (7년 이상) - 업계 최고 대기업 - 최우대,휴머레인컨설팅,경력7년↑학력무관정규직,서울강남구,"Python, AWS, 머신러닝, 앱개발, 클라우드 외 등록일 22/11/19",https://www.saramin.co.kr/zf_user/jobs/relay/view?isMypage=no&rec_idx=44467468
[ESTsecurity] 서버 백엔드 개발자 (리드급),(주)이스트시큐리티,경력 10~18년학력무관정규직,서울전체,"Python, Java, AWS, 웹개발, 백엔드/서버개발 외 등록일 22/08/23",https://www.saramin.co.kr/zf_user/jobs/relay/view?isMypage=no&rec_idx=43829071
[테크사업부] 시니어 프론트엔드 개발자,매드업,경력 5~10년대졸↑정규직·전문연구요원,서울서초구,"AWS, 프론트엔드, Javascript, TypeScript, 유지보수 외 등록일 22/11/01",https://www.saramin.co.kr/zf_user/jobs/relay/view?isMypage=no&rec_idx=44330239
(주)웨이브웨어 2022 년도 (프로그래머) 신입.경력 모집,(주)웨이브웨어,"신입학력무관정규직3,700 만원",대전유성구,"Python, Java, C++, Linux, Windows 외 수정일 22/10/31",https://www.saramin.co.kr/zf_user/jobs/relay/view?isMypage=no&rec_idx=44326305
IT 연구개발 신입 연구원 채용,(주)동우지씨에스,신입초대졸↑정규직,경기시흥시,"자동제어, PLC, SCADA, plc, HMI 외 수정일 22/11/10",https://www.saramin.co.kr/zf_user/jobs/relay/view?isMypage=no&rec_idx=44405972
[오디오플랫폼FLO] Data Engineer,(주)드림어스컴퍼니,경력 1~12년학력무관정규직,서울전체,"Python, AWS, 웹개발, 빅데이터, 백엔드/서버개발 외 수정일 22/09/22",https://www.saramin.co.kr/zf_user/jobs/relay/view?isMypage=no&rec_idx=41102895
고속 고정밀 기계설계 산업용로봇 로봇시스템 DIE BONDER Rework,(주)코리아휴먼리소시스,경력5년↑대졸↑정규직,충남아산시,"설계엔지니어, 공정설계, 제품설계, 구조해석/설계, 기계설계 외 등록일 22/11/15",https://www.saramin.co.kr/zf_user/jobs/relay/view?isMypage=no&rec_idx=44440493
보안개발(자동화) 담당자 모집,넷마블(주),경력3년↑학력무관정규직,서울구로구,"Python, 백엔드/서버개발, 데이터분석가, 보안컨설팅, 정보보안 외 수정일 22/08/19",https://www.saramin.co.kr/zf_user/jobs/relay/view?isMypage=no&rec_idx=43750886
DevOps Engineer,(주)퓨리오사에이아이,경력2년↑대졸↑,서울강남구,"Python, AWS, Linux, DevOps, Azure 외 수정일 22/11/11",https://www.saramin.co.kr/zf_user/jobs/relay/view?isMypage=no&rec_idx=44409360
Machine vision S/W engineer 채용,(주)비트리,신입대졸↑정규직,경기성남시 분당구,"Python, C++, 머신러닝, 딥러닝, 알고리즘 외 수정일 22/10/24",https://www.saramin.co.kr/zf_user/jobs/relay/view?isMypage=no&rec_idx=44233983
[대기업계열 반도체설계] RTL Verification,(주)인코리아 프로페셔널(In Korea Professional),경력 2~12년대졸↑정규직,경기성남시 분당구,"설계엔지니어, 회로설계, 반도체설계, 반도체, Verilog 외 등록일 22/11/07",https://www.saramin.co.kr/zf_user/jobs/relay/view?isMypage=no&rec_idx=44374401
[의료 AI기업] 임상통계연구원/의공학연구원/연구행정담당 모집,뉴로핏(주),경력무관대졸↑정규직,서울강남구,"Python, 빅데이터, 머신러닝, 데이터분석가, 데이터엔지니어 외 등록일 22/11/15",https://www.saramin.co.kr/zf_user/jobs/relay/view?isMypage=no&rec_idx=44433479
반도체 소자 엔지니어(시니어),(주)알세미,경력 4~10년석사↑정규직,서울강남구,"반도체, SI·시스템통합 등록일 22/11/18",https://www.saramin.co.kr/zf_user/jobs/relay/view?isMypage=no&rec_idx=44465041
Front-end Developer (AI 기반 클라우드),오케스트로(주),경력 2~10년대졸↑정규직,서울전체,"Python, Java, 웹개발, 빅데이터, 프론트엔드 외 수정일 22/11/17",https://www.saramin.co.kr/zf_user/jobs/relay/view?isMypage=no&rec_idx=44349001
Full Stack Developer (Public Cloud Platform Solution),오케스트로(주),신입·경력학력무관정규직,서울전체,"Python, Java, AWS, 웹개발, 빅데이터 외 수정일 22/11/02",https://www.saramin.co.kr/zf_user/jobs/relay/view?isMypage=no&rec_idx=44348998
"[서울, 부산] SM 프로젝트 개발자 모집",(주)케이에스에이솔루션,경력6년↑학력무관프리랜서700 만원,부산강서구,"Python, Java, 솔루션, SQL, SI·시스템통합 외 수정일 22/11/14",https://www.saramin.co.kr/zf_user/jobs/relay/view?isMypage=no&rec_idx=44389617
